score;cup;title;category;region;province;municipality;value_eur;client;phase;status;source_url
100;C91D22000010001;OPERE PER IL TRASFERIMENTO DI RISORSE IDRICHE ATTE AD AUMENTARE LA RESILIENZA DELL'AGROSISTEMA IRRIGUO AGLI EVENTI CLIMATICI ESTREMI, RIDURRE LE PERDITE, GARANTIRE LA DOTAZIONE IRRIGUA A COLTURE DI PREGIO DOP/IGP E FAVORIRE LA TUTELA AMBIENTALE.;Sanità / RSA;VENETO;TREVISO;GORGO AL MONTICANO;40000000.0;CONSORZIO DI BONIFICA VENETO ORIENTALE;programmazione / progetto attivo;ATTIVO;https://www.opencup.gov.it/portale/progetto/-/cup/C91D22000010001
100;J24D20000010001;LINEA PADOVA-CASTELFRANCO;Infrastrutture / parcheggi;VENETO;PADOVA;TUTTI;40000000.0;RETE FERROVIARIA ITALIANA S.P.A.;programmazione / progetto attivo;ATTIVO;https://www.opencup.gov.it/portale/progetto/-/cup/J24D20000010001
100;J81G22000000001;RIQUALIFICAZIONE INTEGRATA DELLA COSTA NORD  URBANISTICA, INFRASTRUTTURE E MOBILITÀ DOLCE;Riqualificazione urbana;PUGLIA;BRINDISI;BRINDISI;40000000.0;COMUNE DI BRINDISI - BR -;programmazione / progetto attivo;ATTIVO;https://www.opencup.gov.it/portale/progetto/-/cup/J81G22000000001
100;B42B24000930001;FIUME LAMBRO;Ambiente / rifiuti / depurazione;LOMBARDIA;MONZA E DELLA BRIANZA;MONZA;40000000.0;AGENZIA INTERREGIONALE PER IL FIUME PO- AIPO;programmazione / progetto attivo;ATTIVO;https://www.opencup.gov.it/portale/progetto/-/cup/B42B24000930001
100;D62H16000010002;UFFICI GIUDIZIARI;Riqualificazione urbana;SICILIA;CATANIA;CATANIA;40000000.0;MINISTERO DELLE INFRASTRUTTURE E DEI TRASPORTI;programmazione / progetto attivo;ATTIVO;https://www.opencup.gov.it/portale/progetto/-/cup/D62H16000010002
100;C68F17000040003;LAVORI PER LA RIQUALIFICAZIONE E LA RISTRUTTURAZIONE DELLA CASERMA PIZZOLATO IN USO ALL'ESERCITO NELLA PROVINCIA DI TRENTO;Riqualificazione urbana;TRENTINO-ALTO ADIGE;TRENTO;TRENTO;40000000.0;PROVINCIA AUTONOMA DI TRENTO;programmazione / progetto attivo;ATTIVO;https://www.opencup.gov.it/portale/progetto/-/cup/C68F17000040003
100;F15F21002520006;NUOVO OSPEDALE DI LEGNAGO;Sanità / RSA;VENETO;VERONA;LEGNAGO;40000000.0;AZIENDA ULSS N. 9 SCALIGERA;programmazione / progetto attivo;ATTIVO;https://www.opencup.gov.it/portale/progetto/-/cup/F15F21002520006
100;D81B18000450002;SUPERSTRADA PEDEMONTANA VENETA;Infrastrutture / parcheggi;VENETO;TREVISO;VIDOR;40000000.0;VENETO STRADE SPA;programmazione / progetto attivo;ATTIVO;https://www.opencup.gov.it/portale/progetto/-/cup/D81B18000450002
100;G35H22000080001;RETI FOGNARIE ISOLA DI ISCHIA (NA);Ambiente / rifiuti / depurazione;CAMPANIA;NAPOLI;ISCHIA;40000000.0;UNITÀ TECNICA - AMMINISTRATIVA EX OPCM 3920;programmazione / progetto attivo;ATTIVO;https://www.opencup.gov.it/portale/progetto/-/cup/G35H22000080001
100;F93J04000070002;INTERVENTI URGENTI PER LA TUTELA E LA CONSERVAZIONE DELLE PRATERIE E DEI PASCOLI SU SUBSTRATO CALCAREO;Ambiente / rifiuti / depurazione;TOSCANA;GROSSETO;ARCIDOSSO;40000000.0;COMUNITA' MONTANA DEL MONTE AMIATA;chiuso;CHIUSO;https://www.opencup.gov.it/portale/progetto/-/cup/F93J04000070002
100;F37H21002920001;SS19TER;Infrastrutture / parcheggi;CAMPANIA;SALERNO;SALA CONSILINA;40000000.0;ANAS S.P.A.;programmazione / progetto attivo;ATTIVO;https://www.opencup.gov.it/portale/progetto/-/cup/F37H21002920001
100;D91B24000010002;VARIE;Infrastrutture / parcheggi;VENETO;PADOVA;PADOVA;40000000.0;VENETO STRADE SPA;programmazione / progetto attivo;ATTIVO;https://www.opencup.gov.it/portale/progetto/-/cup/D91B24000010002
100;B61E16000780001;INTERVENTI INFRASTRUTTURALI CON SISTEMAZIONE AREE VERDI E REALIZZAZIONE TRAM O BRT;Riqualificazione urbana;CAMPANIA;NAPOLI;NAPOLI;40000000.0;COMUNE DI NAPOLI - NA -;programmazione / progetto attivo;ATTIVO;https://www.opencup.gov.it/portale/progetto/-/cup/B61E16000780001
100;F79C10000280009;PROGRAMMA DI RIQUALIFICAZIONE URBANA PER ALLOGGI A CANONE SOSTENIBILE GAZZERA MATTUGLIE;Riqualificazione urbana;VENETO;VENEZIA;VENEZIA;40000000.0;soggetto privato;programmazione / progetto attivo;ATTIVO;https://www.opencup.gov.it/portale/progetto/-/cup/F79C10000280009
100;G46J24000060001;RIQUALIFICAZIONE DEL COMPLESSO TERMALE DI ACIREALE;Riqualificazione urbana;SICILIA;CATANIA;ACIREALE;40000000.0;REGIONE AUTONOMA DELLA SICILIA;programmazione / progetto attivo;ATTIVO;https://www.opencup.gov.it/portale/progetto/-/cup/G46J24000060001
100;H53B11000320003;INVASO SUL TORRENTE ASTICO;Ambiente / rifiuti / depurazione;VENETO;VICENZA;BREGANZE;40000000.0;REGIONE VENETO;programmazione / progetto attivo;ATTIVO;https://www.opencup.gov.it/portale/progetto/-/cup/H53B11000320003
100;E97H08000390009;STRADA PROVINCIALE N. 24;Infrastrutture / parcheggi;SICILIA;SIRACUSA;NOTO;40000000.0;PROVINCIA REGIONALE DI SIRACUSA;chiuso;CHIUSO D'UFFICIO;https://www.opencup.gov.it/portale/progetto/-/cup/E97H08000390009
100;G61B10000520001;S.P. N. 46 VAR;Infrastrutture / parcheggi;VENETO;VICENZA;COSTABISSARA;40000000.0;AUTOSTRADA BRESCIA VERONA VICENZA PADOVA S.P.A.;chiuso;CHIUSO;https://www.opencup.gov.it/portale/progetto/-/cup/G61B10000520001
100;F95E22000560005;NUOVO POLO SCOLASTICO DI OLBIA;Scuole / formazione;SARDEGNA;SASSARI;OLBIA;40000000.0;COMUNE DI OLBIA - OT -;programmazione / progetto attivo;ATTIVO;https://www.opencup.gov.it/portale/progetto/-/cup/F95E22000560005
100;D68H25001560001;CANALE IRRIGUO ADDA- CHERIO IN PROVINCIA DI BERGAMO. TRATTO MEDOLAGO-FILAGO.;Ambiente / rifiuti / depurazione;LOMBARDIA;BERGAMO;SUISIO;40000000.0;CONSORZIO DI BONIFICA DELLA MEDIA PIANURA BERGAMASCA;programmazione / progetto attivo;ATTIVO;https://www.opencup.gov.it/portale/progetto/-/cup/D68H25001560001
100;H34H22000880006;OPERE INFRASTRUTTURALI A SERVIZIO DELL'AGGLOMERATO INDUSTRIALE ASI DI ACERRA - ZES CAMPANIA - REALIZZAZIONE OPERE DI URBANIZZAZIONE PRIMARIA;Scuole / formazione;CAMPANIA;NAPOLI;ACERRA;40000000.0;COMMISSARIO STRAORDINARIO DEL GOVERNO PER LA ZES CAMPANIA;programmazione / progetto attivo;ATTIVO;https://www.opencup.gov.it/portale/progetto/-/cup/H34H22000880006
100;J89H10000000003;OSPEDALE MAGALINI DI VILLAFRANCA DI VERONA;Sanità / RSA;VENETO;VERONA;VILLAFRANCA DI VERONA;40000000.0;ASL DI BUSSOLENGO;programmazione / progetto attivo;ATTIVO;https://www.opencup.gov.it/portale/progetto/-/cup/J89H10000000003
100;C85J05000070004;approvazione progetto definitivo esecutivo per la sostituzione di parte delle veneziane e del portone di ingresso principale della scuola media ricci muratori;Scuole / formazione;EMILIA-ROMAGNA;RAVENNA;RAVENNA;40000000.0;COMUNE DI RAVENNA - RA -;chiuso;CHIUSO;https://www.opencup.gov.it/portale/progetto/-/cup/C85J05000070004
100;F21B23000110001;S.S. 78 AMANDOLA - MOZZANO LAVORI DI ADEGUAMENTO E/O MIGLIORAMENTO TECNICO FUNZIONALE - DA COMUNANZA AD AMANDOLA - 2° STRALCIO;Infrastrutture / parcheggi;MARCHE;ASCOLI PICENO;COMUNANZA;40000000.0;ANAS S.P.A.;programmazione / progetto attivo;ATTIVO;https://www.opencup.gov.it/portale/progetto/-/cup/F21B23000110001
100;D41B22001450001;COLLEGAMENTO STRADA ABRIOLA-POTENZA CAPOLUOGO;Infrastrutture / parcheggi;BASILICATA;POTENZA;ABRIOLA;40000000.0;COMUNE DI ABRIOLA - POTENZA -;programmazione / progetto attivo;ATTIVO;https://www.opencup.gov.it/portale/progetto/-/cup/D41B22001450001
100;F67H19001540001;S.S. 658 POTENZA-MELFI S.S. 658DIR;Infrastrutture / parcheggi;BASILICATA;POTENZA;MELFI;40000000.0;ANAS S.P.A.;programmazione / progetto attivo;ATTIVO;https://www.opencup.gov.it/portale/progetto/-/cup/F67H19001540001
100;J31I22000510001;PORTO DI ANCONA;Riqualificazione urbana;MARCHE;ANCONA;ANCONA;40000000.0;AUTORITA' DI SISTEMA PORTUALE DEL MARE ADRIATICO CENTRALE;programmazione / progetto attivo;ATTIVO;https://www.opencup.gov.it/portale/progetto/-/cup/J31I22000510001
100;F61B20000140001;S.S. N. 38 DELLO STELVIO - TANGENZIALE SUD DI SONDRIO;Infrastrutture / parcheggi;LOMBARDIA;SONDRIO;MONTAGNA IN VALTELLINA;40000000.0;SOCIETÀ INFRASTRUTTURE MILANO CORTINA 2020  2026 S.P.A.;programmazione / progetto attivo;ATTIVO;https://www.opencup.gov.it/portale/progetto/-/cup/F61B20000140001
100;G18B23000400001;LAVORI DI RIEFFICIENTAMENTO, MIGLIORAMENTO E AMPLIAMENTO DEGLI IMPIANTI IRRIGUI CONSORTILI NEL COMPRENSORIO GARCIA  ARANCIO;Ambiente / rifiuti / depurazione;SICILIA;AGRIGENTO;MENFI;40000000.0;CONSORZIO DI BONIFICA 3 AGRIGENTO;programmazione / progetto attivo;ATTIVO;https://www.opencup.gov.it/portale/progetto/-/cup/G18B23000400001
100;H71E02000030001;SISTEMAZIONE DELLE AREE DI PERTINENZA DELLA SCUOLA MATERNA E DELLA SCUOLA ELEMENTARE DI ZOLLA/COL;Scuole / formazione;FRIULI-VENEZIA GIULIA;TRIESTE;MONRUPINO;40000000.0;COMUNE DI MONRUPINO - TRIESTE -;chiuso;CHIUSO;https://www.opencup.gov.it/portale/progetto/-/cup/H71E02000030001
100;E45E23000080001;POLO SCOLASTICO TECNICO SAN MARINO;Scuole / formazione;ABRUZZO;TERAMO;TERAMO;40000000.0;AMMINISTRAZIONE PROVINCIALE DI TERAMO;programmazione / progetto attivo;ATTIVO;https://www.opencup.gov.it/portale/progetto/-/cup/E45E23000080001
100;F74H10000060009;PROGRAMMA DI RIQUALIFICAZIONE URBANA PER ALLOGGI A CANONE SOSTENIBILE - VIA MATTUGLIE - GAZZERA - VENEZIA;Riqualificazione urbana;VENETO;VENEZIA;VENEZIA;40000000.0;soggetto privato;programmazione / progetto attivo;ATTIVO;https://www.opencup.gov.it/portale/progetto/-/cup/F74H10000060009
100;H31B21003670001;SUB COMPRENSORIO 1-2 E 3 - IMPIANTI DI DEPURAZIONE DI ANGRI E SCAFATI, SCHEMA DEI COLLETTORI COMPRENSORIALI;Ambiente / rifiuti / depurazione;CAMPANIA;SALERNO;ANGRI;40000000.0;G.O.R.I. S.P.A. GESTIONE OTTIMALE RISORSE IDRICHE;programmazione / progetto attivo;ATTIVO;https://www.opencup.gov.it/portale/progetto/-/cup/H31B21003670001
100;J61B22001980001;COMPLETAMENTO E MESSA IN SICUREZZA DELLA STRADA DI COLLEGAMENTO TRA CASTROVILLARI, LO SVINCOLO AUTOSTRADALE A2 DI FRASCINETO E CASSANO ALLO IONIO;Infrastrutture / parcheggi;CALABRIA;COSENZA;CASSANO ALLO IONIO;40000000.0;REGIONE CALABRIA;programmazione / progetto attivo;ATTIVO;https://www.opencup.gov.it/portale/progetto/-/cup/J61B22001980001
100;G82D22002880005;ACCORDO QUADRO PER L'AFFIDAMENTO DI INTERVENTI DI MANUTENZIONE ORDINARIA, STRAORDINARIA E RIQUALIFICAZIONE SUGLI IMMOBILI DI PROPRIETA' E/O IN GESTIONE ATER DEL COMUNE DI ROMA DIVISO IN N. 6 LOTTI DURATA 4 ANNI;Riqualificazione urbana;LAZIO;ROMA;ROMA;40000000.0;AZIENDA TERRITORIALE PER L'EDILIZIA RESIDENZIALE PUBBLICA DEL COMUNE DI ROMA;programmazione / progetto attivo;ATTIVO;https://www.opencup.gov.it/portale/progetto/-/cup/G82D22002880005
100;G98B21002260005;CONDOTTA IDRICA DI INTERCONNESSIONE TRA IL CAMPO POZZI DI COGNENTO A MODENA E LA DORSALE PRINCIPALE DI DISTRIBUZIONE DEL SISTEMA ACQUEDOTTISTICO IN DESTRA SECCHIA;Sanità / RSA;EMILIA-ROMAGNA;MODENA;BOMPORTO;40000000.0;AIMAG SPA;programmazione / progetto attivo;ATTIVO;https://www.opencup.gov.it/portale/progetto/-/cup/G98B21002260005
100;E58H24001070001;TORRENTE SAMOGGIA - INTERVENTO DI CONSOLIDAMENTO DELLE ARGINATURE, CON EVENTUALE ARRETRAMENTO, E RIPROFILATURA DEI PIANI GOLENALI.;Ambiente / rifiuti / depurazione;EMILIA-ROMAGNA;BOLOGNA;CASTELLO D'ARGILE;40000000.0;REGIONE EMILIA ROMAGNA;programmazione / progetto attivo;ATTIVO;https://www.opencup.gov.it/portale/progetto/-/cup/E58H24001070001
100;B94E03000060002;Lavori di sistemazione delle strade interne Via Ariella ed altre;Infrastrutture / parcheggi;CAMPANIA;BENEVENTO;SAN MARCO DEI CAVOTI;40000000.0;COMUNE DI SAN MARCO DEI CAVOTI - BENEVENTO -;chiuso;CHIUSO;https://www.opencup.gov.it/portale/progetto/-/cup/B94E03000060002
100;H41E13000230003;NUOVO OSPEDALE DEI BAMBINI REALIZZAZIONE DI UN NUOVO VOLUME OSPEDALIERO E INTERVENTI DI ADEGUAMENTO E ACCREDITAMENTO DI ALCUNE AREE PRESSO IL P.O.BUZZI MILANO;Sanità / RSA;LOMBARDIA;MILANO;MILANO;40000000.0;ARIA S.P.A. - AZIENDA REGIONALE PER L'INNOVAZIONE E GLI ACQUISTI;programmazione / progetto attivo;ATTIVO;https://www.opencup.gov.it/portale/progetto/-/cup/H41E13000230003
100;G79J18000420001;AZIENDA OSPEDALIERO - UNIVERSITARIA OSPEDALI RIUNITI DI FOGGIA;Residenziale pubblico / ERS;PUGLIA;FOGGIA;FOGGIA;40000000.0;AZIENDA OSPEDALIERA UNIVERSITARIA OSPEDALI RIUNITI DI FOGGIA;programmazione / progetto attivo;ATTIVO;https://www.opencup.gov.it/portale/progetto/-/cup/G79J18000420001
100;H46G08000160003;STRADE PROVINCIALI DEL NUCLEO TRIGNO-BIFERNO;Infrastrutture / parcheggi;MOLISE;ISERNIA;FROSOLONE;40000000.0;AMMINISTRAZIONE PROVINCIALE DI ISERNIA;programmazione / progetto attivo;ATTIVO;https://www.opencup.gov.it/portale/progetto/-/cup/H46G08000160003
100;H37H20001490007;ATTIVITÀ DI RIPRISTINO E CONSOLIDAMENTO CONNESSE CON LASSESSMENT GALLERIE NELLE COMPETENZE DELLA DIREZIONE 1° TRONCO DI GENOVA;Infrastrutture / parcheggi;LIGURIA;GENOVA;GENOVA;40000000.0;AUTOSTRADE PER L'ITALIA S.P.A.;programmazione / progetto attivo;ATTIVO;https://www.opencup.gov.it/portale/progetto/-/cup/H37H20001490007
100;H21B19000280002;COLLEGAMENTO TRASVERSALE TRA LE STRADE F.V. TRIGNO E F.V. BIFERNO - FONDO VALLE FRESILIA - COMPLETAMENTO DELLA FRESILIA IN DIREZIONE SPRONDASINO.;Sanità / RSA;MOLISE;ISERNIA;CIVITANOVA DEL SANNIO;40000000.0;AMMINISTRAZIONE PROVINCIALE DI ISERNIA;programmazione / progetto attivo;ATTIVO;https://www.opencup.gov.it/portale/progetto/-/cup/H21B19000280002
100;D21B24000030002;VARIE;Infrastrutture / parcheggi;VENETO;VENEZIA;IESOLO;40000000.0;VENETO STRADE SPA;programmazione / progetto attivo;ATTIVO;https://www.opencup.gov.it/portale/progetto/-/cup/D21B24000030002
100;G82E22000030002;INTERVENTI STRAORDINARI SULLA RETE IDRICA DI DISTRIBUZIONE FUNZIONALI AL COMPLETAMENTO DELLA DISTRETTUALIZZAZIONE, ALLA DIGITALIZZAZIONE, AL MONITORAGGIO E ALLA RIDUZIONE DELLE PERDITE;Ambiente / rifiuti / depurazione;EMILIA-ROMAGNA;MODENA;MIRANDOLA;40000000.0;AIMAG SPA;programmazione / progetto attivo;ATTIVO;https://www.opencup.gov.it/portale/progetto/-/cup/G82E22000030002
100;F43J13000000003;COSTRUZIONE IMPIANTO DEPURAZIONE IN LOCALITA TONO E RELATIVE RETI DI COLLEGAMENTO;Ambiente / rifiuti / depurazione;SICILIA;MESSINA;MESSINA;40000000.0;PRESIDENZA DEL CONSIGLIO DEI MINISTRI;programmazione / progetto attivo;ATTIVO;https://www.opencup.gov.it/portale/progetto/-/cup/F43J13000000003
100;B37H12002190003;PROVINCIA AUTONOMA DI BOLZANO - 12.5 SERVIZIO STRADE VAL D'ISARCO;Infrastrutture / parcheggi;TRENTINO-ALTO ADIGE;BOLZANO;BRESSANONE;40000000.0;PROVINCIA AUTONOMA DI BOLZANO;chiuso;CHIUSO;https://www.opencup.gov.it/portale/progetto/-/cup/B37H12002190003
100;F67H16000520001;SS.SS. DELLA REGIONE SICILIA;Infrastrutture / parcheggi;SICILIA;TUTTE;TUTTI;40000000.0;ANAS S.P.A.;programmazione / progetto attivo;ATTIVO;https://www.opencup.gov.it/portale/progetto/-/cup/F67H16000520001
100;D21B24000110001;COMPLETAMENTO LAVORI DI COSTRUZ. DELLA STRADA DI COLLEG. TRA LA F.V. TAPPINO  RICCIA  COLLETORTO  SAN GIULIANO DI PUGLIA  S.S. 376 ALLINNESTO CON LA STRADA IN CORSO DI REALIZ. E TRA S. CROCE DI MAGLIANO E LA S.S. 87 (PIANE DI LARINO) - 1° STRALCIO;Infrastrutture / parcheggi;MOLISE;CAMPOBASSO;SAN GIULIANO DI PUGLIA;40000000.0;REGIONE MOLISE;programmazione / progetto attivo;ATTIVO;https://www.opencup.gov.it/portale/progetto/-/cup/D21B24000110001
100;H17B16000800005;INFRASTRUTTURE CIVILI, STRADALI ED IMPIANTISTICHE PRESSO GLI AEROPORTI DI MILANO LINATE E MALPENSA;Infrastrutture / parcheggi;LOMBARDIA;VARESE;FERNO;40000000.0;SOCIETÀ PER AZIONI ESERCIZI AEROPORTUALI S.E.A.;programmazione / progetto attivo;ATTIVO;https://www.opencup.gov.it/portale/progetto/-/cup/H17B16000800005
100;H51J24001420001;INTERVENTI STRUTTURALI SUL RETICOLO PRINCIPALE E SECONDARIO DEL DISTRETTO DELL'APPENNINO SETTENTRIONALE - LOTTI FUNZIONALI;Ambiente / rifiuti / depurazione;TOSCANA;TUTTE;TUTTI;40000000.0;AUTORITÀ DI BACINO DISTRETTUALE DELL'APPENNINO SETTENTRIONALE;programmazione / progetto attivo;ATTIVO;https://www.opencup.gov.it/portale/progetto/-/cup/H51J24001420001
100;G34H19000100001;DIGA DISUERI - LAVORI PER IL RECUPERO DI CAPACITÀ UTILE DELLINVASO ED EFFICIENZA DELLO SCARICO DI FONDO;Ambiente / rifiuti / depurazione;SICILIA;CALTANISSETTA;GELA;40000000.0;REGIONE AUTONOMA DELLA SICILIA;programmazione / progetto attivo;ATTIVO;https://www.opencup.gov.it/portale/progetto/-/cup/G34H19000100001
100;E41D22000400005;IMPIANTO DI POTABILIZZAZIONE;Ambiente / rifiuti / depurazione;PUGLIA;BARLETTA-ANDRIA-TRANI;MINERVINO MURGE;40000000.0;ACQUEDOTTO PUGLIESE S.P.A.;programmazione / progetto attivo;ATTIVO;https://www.opencup.gov.it/portale/progetto/-/cup/E41D22000400005
100;F91B21002580001;PORTO VECCHIO TRIESTE: VIALE MONUMENTALE E RECUPERO TRACCIATO FERROVIARIO PARCO LINEARE;Riqualificazione urbana;FRIULI-VENEZIA GIULIA;TRIESTE;TRIESTE;40000000.0;COMUNE DI TRIESTE - TRIESTE -;programmazione / progetto attivo;ATTIVO;https://www.opencup.gov.it/portale/progetto/-/cup/F91B21002580001
100;E79G03000010002;LAVORI DI ORDINARIA MANUTENZIONE PER L'ASPORTO DEI RIFIUTI ADDOSSATI AI MANUFATTI IDRAULICI DI PADOVA;Ambiente / rifiuti / depurazione;VENETO;PADOVA;PADOVA;40000000.0;REGIONE VENETO;programmazione / progetto attivo;ATTIVO;https://www.opencup.gov.it/portale/progetto/-/cup/E79G03000010002
100;D81B24000030006;LAVORI DI REALIZZAZIONE DI PISTA CICLABILE DENOMINATA VIA DEL PO E DEL MONVISO;Infrastrutture / parcheggi;PIEMONTE;TORINO;VILLAFRANCA PIEMONTE;40000000.0;COMUNE DI VILLAFRANCA PIEMONTE - TO -;programmazione / progetto attivo;ATTIVO;https://www.opencup.gov.it/portale/progetto/-/cup/D81B24000030006
100;J86J13000450002;INTERVENTI DI MESSA IN SICUREZZA E BONIFICA FALDA - 1° STRALCIO FUNZIONALE- AREA MICOROSA;Ambiente / rifiuti / depurazione;PUGLIA;BRINDISI;BRINDISI;40000000.0;COMUNE DI BRINDISI - BR -;programmazione / progetto attivo;ATTIVO;https://www.opencup.gov.it/portale/progetto/-/cup/J86J13000450002
100;C75E05000210003;Lavori adeguamento impianto illuminazione del Parco della Scuola Agraria;Scuole / formazione;CALABRIA;CATANZARO;TUTTI;40000000.0;AMMINISTRAZIONE PROVINCIALE DI CATANZARO;chiuso;CHIUSO D'UFFICIO;https://www.opencup.gov.it/portale/progetto/-/cup/C75E05000210003
100;B94E03000050002;Lavori di sistemazione delle strade di collegamento al centro urbano in località Ciannavera ed altre;Infrastrutture / parcheggi;CAMPANIA;BENEVENTO;SAN MARCO DEI CAVOTI;40000000.0;COMUNE DI SAN MARCO DEI CAVOTI - BENEVENTO -;chiuso;CHIUSO;https://www.opencup.gov.it/portale/progetto/-/cup/B94E03000050002
100;D41I08000080009;FINCANTIERI - CANTIERI NAVALI ITALIANI SPA;Edilizia pubblica;FRIULI-VENEZIA GIULIA;GORIZIA;MONFALCONE;40000000.0;REGIONE AUTONOMA FRIULI VENEZIA GIULIA;chiuso;CHIUSO;https://www.opencup.gov.it/portale/progetto/-/cup/D41I08000080009
100;D62E22001450006;COMUNI DELLA MEDIA  ALTA VALLE DEL TORRENTE SENTINO;Ambiente / rifiuti / depurazione;MARCHE;ANCONA;BELVEDERE OSTRENSE;40000000.0;soggetto privato;programmazione / progetto attivo;ATTIVO;https://www.opencup.gov.it/portale/progetto/-/cup/D62E22001450006
100;J57H04000680004;Sostituzione tratti di tubazione acquedotto comunale Via Cappelletta Via Stallone;Ambiente / rifiuti / depurazione;LOMBARDIA;COMO;RONAGO;40000000.0;COMUNE DI RONAGO - COMO -;chiuso;CHIUSO;https://www.opencup.gov.it/portale/progetto/-/cup/J57H04000680004
100;F77H23000940001;A 19 AUTOSTRADA PALERMO CATANIA;Infrastrutture / parcheggi;SICILIA;ENNA;ENNA;40000000.0;ANAS S.P.A.;programmazione / progetto attivo;ATTIVO;https://www.opencup.gov.it/portale/progetto/-/cup/F77H23000940001
100;E71B04000030001;S.P. EX S.S. N. 639: DEI LAGHI DI PUSIANO E DI GARLATE VARIANTE DI CISANO BERGAMASCO. PRIMO LOTTO STRALCIO;Infrastrutture / parcheggi;LOMBARDIA;BERGAMO;CISANO BERGAMASCO;40000000.0;AMMINISTRAZIONE PROVINCIALE DI BERGAMO;programmazione / progetto attivo;ATTIVO;https://www.opencup.gov.it/portale/progetto/-/cup/E71B04000030001
100;F72J20002270001;VENEZIA -MARGHERA- EX SCUOLA MONTEVERDI SITA IN VIA ULLOA;Scuole / formazione;VENETO;VENEZIA;VENEZIA;40000000.0;MINISTERO DELL'INTERNO;programmazione / progetto attivo;ATTIVO;https://www.opencup.gov.it/portale/progetto/-/cup/F72J20002270001
100;F16J06000020004;REALIZZAZIONE AREA VERDE PUBBLICO ATTREZZATO - LOC. CASABELLATA;Riqualificazione urbana;VENETO;BELLUNO;SANTA GIUSTINA;40000000.0;COMUNE DI SANTA GIUSTINA - BELLUNO -;chiuso;CHIUSO;https://www.opencup.gov.it/portale/progetto/-/cup/F16J06000020004
100;I15I07000000002;INTERVENTO DI RECUPERO DI AREE E SITI DEGRADATI DI NON ESTESA DIMENSIONE;Ambiente / rifiuti / depurazione;MOLISE;ISERNIA;ACQUAVIVA D'ISERNIA;40000000.0;COMUNE DI ACQUAVIVA D'ISERNIA - ISERNIA -;chiuso;CHIUSO;https://www.opencup.gov.it/portale/progetto/-/cup/I15I07000000002
100;F78F10000130002;MUSEI, ARCHIVI, BIBLIOTECHE, SITI E AREE ARCHEOLOGICI, MONUMENTI, CONTENITORI CULTURALI, SEDI MIBAC;Riqualificazione urbana;SICILIA;TUTTE;TUTTI;40000000.0;MINISTERO DELLA CULTURA;chiuso;CHIUSO D'UFFICIO;https://www.opencup.gov.it/portale/progetto/-/cup/F78F10000130002
100;B94E21012780001;COLLETTORI LORGANA, GARDA E MENATA, IMPIANTI IDROVORI SAIARINO E VALLESANTA;Ambiente / rifiuti / depurazione;EMILIA-ROMAGNA;FERRARA;ARGENTA;40000000.0;CONSORZIO BONIFICA RENANA;programmazione / progetto attivo;ATTIVO;https://www.opencup.gov.it/portale/progetto/-/cup/B94E21012780001
100;F79C10000300009;PROGRAMMA DI RIQUALIFICAZIONE URBANA PER ALLOGGI A CANONE SOSTENIBILE - VIA MATTUGLIE - GAZZERA - VENEZIA;Riqualificazione urbana;VENETO;VENEZIA;VENEZIA;40000000.0;soggetto privato;programmazione / progetto attivo;ATTIVO;https://www.opencup.gov.it/portale/progetto/-/cup/F79C10000300009
100;F41D25000070004;COMPLETAMENTO OPERAZIONE TUTTO PULITO;Ambiente / rifiuti / depurazione;SICILIA;MESSINA;MESSINA;40000000.0;AZIENDA MERIDIONALE ACQUE MESSINA;programmazione / progetto attivo;ATTIVO;https://www.opencup.gov.it/portale/progetto/-/cup/F41D25000070004
100;F65C00000000002;ACQUEDOTTO COMUNALE FR. CERATI;Ambiente / rifiuti / depurazione;PIEMONTE;CUNEO;BOVES;40000000.0;COMUNE DI BOVES - CUNEO -;chiuso;CHIUSO;https://www.opencup.gov.it/portale/progetto/-/cup/F65C00000000002
100;B17D16000020006;RETI A BANDA ULTRALARGA - VENETO FESR;Scuole / formazione;VENETO;TUTTE;TUTTI;40000000.0;soggetto privato;programmazione / progetto attivo;ATTIVO;https://www.opencup.gov.it/portale/progetto/-/cup/B17D16000020006
100;I96F03000020002;ECOCENTRO PER LA RACCOLTA DIFFERENZIATA DEI RIFIUTI SOLIDI URBANI INTERNI;Ambiente / rifiuti / depurazione;VENETO;VICENZA;VALBRENTA;40000000.0;COMUNE DI VALBRENTA - VICENZA -;chiuso;CHIUSO;https://www.opencup.gov.it/portale/progetto/-/cup/I96F03000020002
100;F61B22000720001;TANGENZIALE AREE INTERNE DI AVELLINO ROCCABASCERANA - ALTAVILLA IRPINA;Infrastrutture / parcheggi;CAMPANIA;AVELLINO;ALTAVILLA IRPINA;40000000.0;AMMINISTRAZIONE PROVINCIALE DI AVELLINO;programmazione / progetto attivo;ATTIVO;https://www.opencup.gov.it/portale/progetto/-/cup/F61B22000720001
100;F31B16000600001;S.S. N. 106 JONICA;Infrastrutture / parcheggi;CALABRIA;REGGIO DI CALABRIA;GERACE;40000000.0;ANAS S.P.A.;programmazione / progetto attivo;ATTIVO;https://www.opencup.gov.it/portale/progetto/-/cup/F31B16000600001
100;F47H09001460001;RA 5 SICIGNANO POTENZA;Infrastrutture / parcheggi;BASILICATA;TUTTE;TUTTI;40000000.0;ANAS S.P.A.;programmazione / progetto attivo;ATTIVO;https://www.opencup.gov.it/portale/progetto/-/cup/F47H09001460001
100;J81B23001000004;PROGRAMMA DEGLI INTERVENTI DI AMMODERNAMENTO E MANUTENZIONE STRAORDINARIA DEGLI IMPIANTI DI ILLUMINAZIONE PUBBLICA;Infrastrutture / parcheggi;LAZIO;ROMA;ROMA;40000000.0;ROMA CAPITALE;programmazione / progetto attivo;ATTIVO;https://www.opencup.gov.it/portale/progetto/-/cup/J81B23001000004
100;D31B20000270001;A 52 TANGENZIALE NORD DI MILANO;Infrastrutture / parcheggi;LOMBARDIA;MILANO;CINISELLO BALSAMO;40000000.0;MILANO SERRAVALLE - MILANO TANGENZIALI S.P.A.;programmazione / progetto attivo;ATTIVO;https://www.opencup.gov.it/portale/progetto/-/cup/D31B20000270001
100;G41B23000190006;LAVORI DI REALIZZAZIONE DELLA STRADA DI COLLEGAMENTO ANZANO DI PUGLIA - SAN PIETRO - CALAGGIO;Infrastrutture / parcheggi;PUGLIA;FOGGIA;ANZANO DI PUGLIA;39999903.0;COMUNE DI ANZANO DI PUGLIA - FOGGIA -;programmazione / progetto attivo;ATTIVO;https://www.opencup.gov.it/portale/progetto/-/cup/G41B23000190006
100;J52I10000000004;VALLE SABBIA;Ambiente / rifiuti / depurazione;LOMBARDIA;BRESCIA;VESTONE;39988000.0;COMUNITA' MONTANA DI VALLE SABBIA;programmazione / progetto attivo;ATTIVO;https://www.opencup.gov.it/portale/progetto/-/cup/J52I10000000004
100;E83E12000170002;COOPERATIVA SOCIALE PROMOZIONE UMANA;Scuole / formazione;SARDEGNA;SASSARI;SASSARI;39970930.0;REGIONE AUTONOMA DELLA SARDEGNA;programmazione / progetto attivo;ATTIVO;https://www.opencup.gov.it/portale/progetto/-/cup/E83E12000170002
100;F12E23000420009;OPERE IRRIGUE DI DISTRIBUZIONE DELLA RISORSA IDRICA ACCUMULATA NELL'INVASO DI CAMPOLATTARO, A SERVIZIO DELLE AREE IRRIGABILI DELLA PROVINCIA DI BENEVENTO AD ESSO SOTTESE  LOTTO FUNZIONALE D6;Scuole / formazione;CAMPANIA;BENEVENTO;TUTTI;39962120.0;CONSORZIO DI BONIFICA DEL SANNIO ALIFANO;programmazione / progetto attivo;ATTIVO;https://www.opencup.gov.it/portale/progetto/-/cup/F12E23000420009
100;C34E21001350003;APOP-SERVIZIO OPERE STRADALI E FERROVIARIE;Infrastrutture / parcheggi;TRENTINO-ALTO ADIGE;TRENTO;ZIANO DI FIEMME;39961651.0;SOCIETÀ INFRASTRUTTURE MILANO CORTINA 2020  2026 S.P.A.;programmazione / progetto attivo;ATTIVO;https://www.opencup.gov.it/portale/progetto/-/cup/C34E21001350003
100;F91B05000060001;S.S. N. 29 DEL COLLE DI CADIBONA;Infrastrutture / parcheggi;LIGURIA;SAVONA;TUTTI;39934628.0;ANAS S.P.A.;programmazione / progetto attivo;ATTIVO;https://www.opencup.gov.it/portale/progetto/-/cup/F91B05000060001
100;F21B03000350001;"S.S. N. 73 BIS DI BOCCA TRABARIA: COSTRUZIONE DELLA BRETELLA DI URBINO DA BIVIO BORZAGA A LOC. LE CONCE, II LOTTO; SOLUZIONE SVINCOLO DI FERMIGNANO E TRATTO TRA IL KM. 1+967,30 E LOC. LE CONCE.";Infrastrutture / parcheggi;MARCHE;PESARO E URBINO;FERMIGNANO;39914120.0;ANAS S.P.A.;programmazione / progetto attivo;ATTIVO;https://www.opencup.gov.it/portale/progetto/-/cup/F21B03000350001
100;F91B09000590001;S.S. N. 1 VIA AURELIA;Infrastrutture / parcheggi;LIGURIA;SAVONA;NOLI;39900000.0;ANAS S.P.A.;programmazione / progetto attivo;ATTIVO;https://www.opencup.gov.it/portale/progetto/-/cup/F91B09000590001
