score;cup;title;category;region;province;municipality;value_eur;client;phase;status;source_url
100;F13D11000400005;PROGETTO DI REALIZZAZIONE DI UN SISTEMA INFORMATIVO WIRELEES PER LA COPERTURA INTERNET DELLE PRINCIPALI PIAZZE DEL QUARTIERE CAMPOLONIANO.;Scuole / formazione;LAZIO;RIETI;RIETI;18150000.0;COMUNE DI RIETI - RI -;programmazione / progetto attivo;ATTIVO;https://www.opencup.gov.it/portale/progetto/-/cup/F13D11000400005
100;F57H22001360001;CENTRO STORICO;Infrastrutture / parcheggi;UMBRIA;PERUGIA;NORCIA;18140000.0;COMUNE DI NORCIA - PG -;programmazione / progetto attivo;ATTIVO;https://www.opencup.gov.it/portale/progetto/-/cup/F57H22001360001
100;F73J08000040001;POLI DI DEPURAZIONE NEI COMUNI DI CIVITA CASTELLANA, SUTRI E VIGNANELLO;Ambiente / rifiuti / depurazione;LAZIO;VITERBO;SUTRI;18085000.0;REGIONE LAZIO;programmazione / progetto attivo;ATTIVO;https://www.opencup.gov.it/portale/progetto/-/cup/F73J08000040001
100;C91B99000000009;ASSE STRADALE PRATO/FIRENZE;Infrastrutture / parcheggi;TOSCANA;FIRENZE;CAMPI BISENZIO;18075991.0;COMUNE DI CAMPI BISENZIO - FI -;chiuso;CHIUSO;https://www.opencup.gov.it/portale/progetto/-/cup/C91B99000000009
100;I62F07000020004;CENTRO SPORTIVO;Sport / impianti sportivi;MARCHE;ANCONA;BELVEDERE OSTRENSE;18000000.0;COMUNE DI BELVEDERE OSTRENSE - AN -;chiuso;CHIUSO;https://www.opencup.gov.it/portale/progetto/-/cup/I62F07000020004
100;G78E22000210006;PARETE ROCCIOSA SANTUARIO SS. TRINITÀ;Ambiente / rifiuti / depurazione;LAZIO;ROMA;VALLEPIETRA;18000000.0;COMUNE DI VALLEPIETRA - ROMA -;programmazione / progetto attivo;ATTIVO;https://www.opencup.gov.it/portale/progetto/-/cup/G78E22000210006
100;E21B21002580001;COMUNE DI AMANDOLA;Infrastrutture / parcheggi;MARCHE;FERMO;AMANDOLA;18000000.0;COMUNE DI AMANDOLA - AP -;programmazione / progetto attivo;ATTIVO;https://www.opencup.gov.it/portale/progetto/-/cup/E21B21002580001
100;B28I17001280008;NUOVO OSPEDALE DI AMANDOLA (FM);Sanità / RSA;MARCHE;FERMO;AMANDOLA;18000000.0;REGIONE MARCHE;programmazione / progetto attivo;ATTIVO;https://www.opencup.gov.it/portale/progetto/-/cup/B28I17001280008
100;H51B22000600006;ITG E.FERMI;Scuole / formazione;TOSCANA;PISTOIA;PISTOIA;18000000.0;AMMINISTRAZIONE PROVINCIALE DI PISTOIA;programmazione / progetto attivo;ATTIVO;https://www.opencup.gov.it/portale/progetto/-/cup/H51B22000600006
100;D76J08000020004;FRAZIONE CAPANNE DI MONTIGNOSO;Riqualificazione urbana;TOSCANA;MASSA-CARRARA;MONTIGNOSO;18000000.0;COMUNE DI MONTIGNOSO - MS -;chiuso;CHIUSO;https://www.opencup.gov.it/portale/progetto/-/cup/D76J08000020004
100;B65F23000400008;OSPEDALE SS.CARLO E DONNINO DI PERGOLA (PU);Sanità / RSA;MARCHE;PESARO E URBINO;PERGOLA;17800000.0;REGIONE MARCHE;programmazione / progetto attivo;ATTIVO;https://www.opencup.gov.it/portale/progetto/-/cup/B65F23000400008
100;G21F11000070003;MUSEO TERRITORIALE DEL LAGO DI BOLSENA;Cultura / centri civici;LAZIO;VITERBO;BOLSENA;17736000.0;AMMINISTRAZIONE PROVINCIALE DI VITERBO;programmazione / progetto attivo;ATTIVO;https://www.opencup.gov.it/portale/progetto/-/cup/G21F11000070003
100;C59F24000110005;TEATRO MANZONI;Cultura / centri civici;TOSCANA;PISTOIA;PISTOIA;17614000.0;COMUNE DI PISTOIA - PT -;programmazione / progetto attivo;ATTIVO;https://www.opencup.gov.it/portale/progetto/-/cup/C59F24000110005
100;D23B07000010001;AREA DI ESPANSIONE DI ROFFIA -CASSA DEI PIAGGIONI;Ambiente / rifiuti / depurazione;TOSCANA;PISA;SAN MINIATO;17500000.0;COMUNE DI SAN MINIATO - PI -;programmazione / progetto attivo;ATTIVO;https://www.opencup.gov.it/portale/progetto/-/cup/D23B07000010001
100;J61B12000090001;PONTI STRADALI;Infrastrutture / parcheggi;TOSCANA;MASSA-CARRARA;MULAZZO;17500000.0;REGIONE TOSCANA;chiuso;CHIUSO;https://www.opencup.gov.it/portale/progetto/-/cup/J61B12000090001
100;F83G22000620001;21 SEDI DELLISTITUZIONE SISTEMA BIBLIOTECHE CENTRI CULTURALI DI ROMA CAPITALE;Riqualificazione urbana;LAZIO;ROMA;ROMA;17500000.0;CITTA' METROPOLITANA DI ROMA CAPITALE;programmazione / progetto attivo;ATTIVO;https://www.opencup.gov.it/portale/progetto/-/cup/F83G22000620001
100;H14E21000080005;EX CASERMA LUPI DI TOSCANA;Residenziale pubblico / ERS;TOSCANA;FIRENZE;FIRENZE;17493074.0;COMUNE DI FIRENZE - FI -;programmazione / progetto attivo;ATTIVO;https://www.opencup.gov.it/portale/progetto/-/cup/H14E21000080005
100;B85F23000110001;INTERVENTI PER LA MESSA IN SICUREZZA DEI PONTI E VIADOTTI ESISTENTI E LA REALIZZAZIONE DI NUOVI PONTI IN SOSTITUZIONE DI QUELLI ESISTENTI CON PROBLEMI STRUTTURALI DI SICUREZZA - ANNI 2024 - 2025 - 2026 - 2027 - 2028 -2029 DM 125/2022;Infrastrutture / parcheggi;TOSCANA;FIRENZE;TUTTI;17426440.0;CITTA' METROPOLITANA DI FIRENZE;programmazione / progetto attivo;ATTIVO;https://www.opencup.gov.it/portale/progetto/-/cup/B85F23000110001
100;E77H11000130004;VIA ASOLA - INTERSEZIONE EX SS. 16 ADRIATICA;Infrastrutture / parcheggi;MARCHE;MACERATA;CIVITANOVA MARCHE;17388000.0;COMUNE DI CIVITANOVA MARCHE - MC -;chiuso;CHIUSO;https://www.opencup.gov.it/portale/progetto/-/cup/E77H11000130004
100;I82D10000000007;FERROVIA ROMA-LIDO;Ambiente / rifiuti / depurazione;LAZIO;ROMA;ROMA;17269998.0;AGENZIA PER I TRASPORTI AUTOFERROTRAMVIARI DEL COMUNE DI ROMA;programmazione / progetto attivo;ATTIVO;https://www.opencup.gov.it/portale/progetto/-/cup/I82D10000000007
100;H61B22000320006;ISTITUTO BARSANTI;Scuole / formazione;TOSCANA;MASSA-CARRARA;MASSA;17136000.0;AMMINISTRAZIONE PROVINCIALE DI MASSA CARRARA;programmazione / progetto attivo;ATTIVO;https://www.opencup.gov.it/portale/progetto/-/cup/H61B22000320006
100;F88H25001880006;LITORALE LAZIALE;Ambiente / rifiuti / depurazione;LAZIO;TUTTE;TUTTI;17134200.0;REGIONE LAZIO;programmazione / progetto attivo;ATTIVO;https://www.opencup.gov.it/portale/progetto/-/cup/F88H25001880006
100;E44F22000030005;PARTENARIATO PUBBLICO DI INIZIATIVA PRIVATA PER LA RIQUALIFICAZIONE ENERGETICA ED IL CONSOLIDAMENTO ANTISISMICO FABBRICATI ERP MEDIANTE I BENEFICI FISCALI DI CUI AL D.L. 34/2020 CONVERTITO CON MODIFICAZIONI CON LA LEGGE 17.7.2020 N. 77;Riqualificazione urbana;TOSCANA;LUCCA;VIAREGGIO;17130160.0;E.R.P. LUCCA S.R.L. (SOGGETTO GESTORE DELL'EDILIZIA RESIDENZIALE PUBBLICA DELLA PROVINCIA DI LUCCA S.R.L.);programmazione / progetto attivo;ATTIVO;https://www.opencup.gov.it/portale/progetto/-/cup/E44F22000030005
100;C35F21000380001;POLO SCIENTIFICO TECNOLOGICO E CULTURALE COMPLESSO SANTANGELO MAGNO  ALA NORD;Riqualificazione urbana;MARCHE;ASCOLI PICENO;ASCOLI PICENO;17113866.0;COMUNE DI ASCOLI PICENO - AP -;programmazione / progetto attivo;ATTIVO;https://www.opencup.gov.it/portale/progetto/-/cup/C35F21000380001
100;I11B02000030009;S.R. N. 71, VARIANTE ESTERNA BIBBIENA, DALLA LOC. POLLINO (BIBBIENA) ALLA LOC. MEMMENANO (POPPI): COSTRUZIONE;Infrastrutture / parcheggi;TOSCANA;AREZZO;BIBBIENA;17071342.0;AMMINISTRAZIONE PROVINCIALE DI AREZZO;chiuso;CHIUSO;https://www.opencup.gov.it/portale/progetto/-/cup/I11B02000030009
100;D55D09000230003;OPC VINCITORI DELLA GARA INDETTA DA REGIONE TOSCANA;Scuole / formazione;TOSCANA;TUTTE;TUTTI;17025532.0;REGIONE TOSCANA;programmazione / progetto attivo;ATTIVO;https://www.opencup.gov.it/portale/progetto/-/cup/D55D09000230003
100;B43D20000190003;INTERVENTO DI RISTRUTTURAZIONE E ADEGUAMENTO A NORMA P.O. DI SORA -OSPEDALE SS. TRINITÀ LOC. SAN MARCIANO SORA;Sanità / RSA;LAZIO;FROSINONE;SORA;17010367.0;ASL DI FROSINONE;programmazione / progetto attivo;ATTIVO;https://www.opencup.gov.it/portale/progetto/-/cup/B43D20000190003
100;E13D22000580001;SISMA 2016. INTERVENTO DI RIFACIMENTO INFRASTRUTTURE CENTRO STORICO CAPOLUOGO;Infrastrutture / parcheggi;MARCHE;MACERATA;CAMERINO;17000000.0;COMUNE DI CAMERINO - MC -;programmazione / progetto attivo;ATTIVO;https://www.opencup.gov.it/portale/progetto/-/cup/E13D22000580001
100;F88E23000200001;RESTAURO, RIFUNZIONALIZZAZIONE E VALORIZZAZIONE DELLANTICO OSPEDALE GRANDE DEGLI INFERMI DI VITERBO, VIA S. LORENZO, 107;Sanità / RSA;LAZIO;VITERBO;VITERBO;17000000.0;REGIONE LAZIO;programmazione / progetto attivo;ATTIVO;https://www.opencup.gov.it/portale/progetto/-/cup/F88E23000200001
100;H11B21001880001;SCUOLA SECONDARIA DI I° GRADO GHIBERTI E IMPIANTO SPORTIVO GEODETICA LEGNAIA;Scuole / formazione;TOSCANA;FIRENZE;FIRENZE;17000000.0;COMUNE DI FIRENZE - FI -;programmazione / progetto attivo;ATTIVO;https://www.opencup.gov.it/portale/progetto/-/cup/H11B21001880001
100;I43C23000290001;RIQUALIFICAZIONE POLO SCIENTIFICO E DIDATTICO DI PENTIMA.;Riqualificazione urbana;UMBRIA;TERNI;TERNI;17000000.0;REGIONE UMBRIA;programmazione / progetto attivo;ATTIVO;https://www.opencup.gov.it/portale/progetto/-/cup/I43C23000290001
100;F47B15000500003;REALIZZAZIONE NUOVO PALASPORT ED OPERE CORRELATE E CONNESSE, OPERE DI STANDARD E DELOCALIZZAZIONE MERCATI GENERALI E MATTATOIO;Infrastrutture / parcheggi;UMBRIA;TERNI;TERNI;17000000.0;COMUNE DI TERNI - TR -;programmazione / progetto attivo;ATTIVO;https://www.opencup.gov.it/portale/progetto/-/cup/F47B15000500003
100;E71B12000250005;SRT 439 SARZANESE VALDERA;Infrastrutture / parcheggi;TOSCANA;PISA;CALCINAIA;17000000.0;AMMINISTRAZIONE PROVINCIALE DI PISA;programmazione / progetto attivo;ATTIVO;https://www.opencup.gov.it/portale/progetto/-/cup/E71B12000250005
100;B81B20001110001;REALIZZAZIONE NUOVO ISTITUTO SCOLASTICO A CAMPI BISENZIO  VIA PRUNAIA CAMPI BISENZIO;Scuole / formazione;TOSCANA;FIRENZE;CAMPI BISENZIO;17000000.0;CITTA' METROPOLITANA DI FIRENZE;programmazione / progetto attivo;ATTIVO;https://www.opencup.gov.it/portale/progetto/-/cup/B81B20001110001
100;I95E22000210005;REALIZZAZIONE IMPIANTO DI CLIMATIZZAZIONE E RISCALDAMENTO ASILO NIDO A. SABIN;Scuole / formazione;MARCHE;PESARO E URBINO;ACQUALAGNA;16982400.0;COMUNE DI ACQUALAGNA - PESARO E URBINO -;programmazione / progetto attivo;ATTIVO;https://www.opencup.gov.it/portale/progetto/-/cup/I95E22000210005
100;E26H08000020007;CAMPO SPORTIVO DELLA MORCIOLA;Sport / impianti sportivi;MARCHE;PESARO E URBINO;VALLEFOGLIA;16970000.0;COMUNE DI COLBORDOLO - PS -;chiuso;CHIUSO;https://www.opencup.gov.it/portale/progetto/-/cup/E26H08000020007
100;F57H22001370001;ZONA INDUSTRIALE;Infrastrutture / parcheggi;UMBRIA;PERUGIA;NORCIA;16840000.0;COMUNE DI NORCIA - PG -;programmazione / progetto attivo;ATTIVO;https://www.opencup.gov.it/portale/progetto/-/cup/F57H22001370001
100;J95E22000380001;REALIZZAZIONE NUOVO EDIFICO AD USO SCUOLA SUPERIORE ISOLA D'ELBA;Scuole / formazione;TOSCANA;LIVORNO;PORTOFERRAIO;16777062.0;AMMINISTRAZIONE PROVINCIALE DI LIVORNO;programmazione / progetto attivo;ATTIVO;https://www.opencup.gov.it/portale/progetto/-/cup/J95E22000380001
100;C57H21001050001;INFRASTRUTTURE E RETE DI SOTTOSERVIZI DEL CAPOLUOGO;Infrastrutture / parcheggi;MARCHE;MACERATA;PIEVE TORINA;16724532.0;COMUNE DI PIEVE TORINA - MC -;programmazione / progetto attivo;ATTIVO;https://www.opencup.gov.it/portale/progetto/-/cup/C57H21001050001
100;D48E18000060002;COSTRUZIONE NUOVO EDIFICIO PER SCUOLA PRIMARIA E SECONDARIA 1° GRADO NEL CAPOLUOGO DI PECCIOLI.;Scuole / formazione;TOSCANA;PISA;PECCIOLI;16700000.0;COMUNE DI PECCIOLI - PISA -;programmazione / progetto attivo;ATTIVO;https://www.opencup.gov.it/portale/progetto/-/cup/D48E18000060002
100;F87H21011460003;FOSSI IN LOC. FOSSONE;Ambiente / rifiuti / depurazione;TOSCANA;MASSA-CARRARA;CARRARA;16632000.0;COMUNE DI CARRARA - MASSA-CARRARA -;programmazione / progetto attivo;ATTIVO;https://www.opencup.gov.it/portale/progetto/-/cup/F87H21011460003
100;I81B21000520001;1 BRETELLA DA VIA PANCALDUCCI A VIA ZORLI E PACE 2 RESTAURO POZZO DEL MERCATO 3 REALIZZAZIONE PARCHEGGI 4 COSTRUZIONE EDIFICIO ALLOGGI ERP 5 CONSOLIDAMENTO MURO CONTRO-TERRA VIA PANTALEONI E ADEGUAMENTO VIA ZORLI;Infrastrutture / parcheggi;MARCHE;MACERATA;MACERATA;16605154.0;COMUNE DI MACERATA - MC -;programmazione / progetto attivo;ATTIVO;https://www.opencup.gov.it/portale/progetto/-/cup/I81B21000520001
100;F51B22000940001;VARIANTE SS 685;Infrastrutture / parcheggi;UMBRIA;PERUGIA;NORCIA;16400000.0;COMUNE DI NORCIA - PG -;programmazione / progetto attivo;ATTIVO;https://www.opencup.gov.it/portale/progetto/-/cup/F51B22000940001
100;E83D13000230004;RACCOLTA RIFIUTI;Ambiente / rifiuti / depurazione;LAZIO;ROMA;GROTTAFERRATA;16290751.0;COMUNE DI GROTTAFERRATA - ROMA -;chiuso;CHIUSO;https://www.opencup.gov.it/portale/progetto/-/cup/E83D13000230004
100;H23E24000990001;EDIFICIO AD USO ABITATIVO;Residenziale pubblico / ERS;MARCHE;MACERATA;TOLENTINO;16266268.0;UFFICIO SPECIALE PER LA RICOSTRUZIONE POST SISMA DEL 2016 DELLA REGIONE MARCHE;programmazione / progetto attivo;ATTIVO;https://www.opencup.gov.it/portale/progetto/-/cup/H23E24000990001
100;C35B22000140005;STADIO DEL NUOTO A IOLO;Sport / impianti sportivi;TOSCANA;PRATO;PRATO;16000000.0;COMUNE DI PRATO - PO -;programmazione / progetto attivo;ATTIVO;https://www.opencup.gov.it/portale/progetto/-/cup/C35B22000140005
100;E41B21003030001;LICEO BARSANTI E MATTEUCCI DI VIAREGGIO;Scuole / formazione;TOSCANA;LUCCA;VIAREGGIO;16000000.0;AMMINISTRAZIONE PROVINCIALE DI LUCCA;programmazione / progetto attivo;ATTIVO;https://www.opencup.gov.it/portale/progetto/-/cup/E41B21003030001
100;E75E23000020001;LAVORI REALIZZAZIONE NUOVA CASA DI RIPOSO;Sanità / RSA;MARCHE;MACERATA;CIVITANOVA MARCHE;16000000.0;COMUNE DI CIVITANOVA MARCHE - MC -;programmazione / progetto attivo;ATTIVO;https://www.opencup.gov.it/portale/progetto/-/cup/E75E23000020001
100;C31B21000620004;PISCINA COMUNALE DI IOLO;Sport / impianti sportivi;TOSCANA;PRATO;PRATO;16000000.0;COMUNE DI PRATO - PO -;programmazione / progetto attivo;ATTIVO;https://www.opencup.gov.it/portale/progetto/-/cup/C31B21000620004
100;H94E21000070006;PINQUA COMUNE DI PERUGIA EX PALAZZETTI;Infrastrutture / parcheggi;UMBRIA;PERUGIA;PERUGIA;16000000.0;A.T.E.R. REGIONE UMBRIA;programmazione / progetto attivo;ATTIVO;https://www.opencup.gov.it/portale/progetto/-/cup/H94E21000070006
100;J88I23001150003;OSPEDALE SAN FILIPPO NERI;Sanità / RSA;LAZIO;ROMA;ROMA;15966320.0;ASL DI ROMA 1;programmazione / progetto attivo;ATTIVO;https://www.opencup.gov.it/portale/progetto/-/cup/J88I23001150003
100;H88D20000370001;REALIZZAZIONE DI UN POLO SCOLASTICO UNICO IN LOCALITÀ PILOZZO;Scuole / formazione;LAZIO;ROMA;MONTE PORZIO CATONE;15961206.0;COMUNE DI MONTE PORZIO CATONE - RM -;programmazione / progetto attivo;ATTIVO;https://www.opencup.gov.it/portale/progetto/-/cup/H88D20000370001
100;C57H21002530005;OPERE DI URBANIZZAZIONE - URBANIZZAZIONE PRIMARIA, RETI TECNOLOGICHE ED OPERE CONNESSE RETI (IDRICA, FOGNARIA,ELETTRICA, TELEFONICA, INTERNET E GAS) PIAZZE, SLARGHI E SPAZI APERTI AD USO PUBBLICO;Scuole / formazione;MARCHE;MACERATA;USSITA;15950743.0;COMUNE DI USSITA - MC -;programmazione / progetto attivo;ATTIVO;https://www.opencup.gov.it/portale/progetto/-/cup/C57H21002530005
100;E17D21000020001;SISMA 2016 - COMPLESSO EX ISTITUTO DI FARMACOLOGIA E EX ISTITUTO DI BIOLOGIA DESTINATO AD OSPITARE ASSOCIAZIONI SPIN-OFF CON ANNESSA SALA POLIVALENTE DELL'EX CHIESA DI SAN GIOVANNI DECOLLATO;Cultura / centri civici;MARCHE;MACERATA;CAMERINO;15900000.0;COMUNE DI CAMERINO - MC -;programmazione / progetto attivo;ATTIVO;https://www.opencup.gov.it/portale/progetto/-/cup/E17D21000020001
100;G86I22000180008;HT FILM SRL;Cultura / centri civici;LAZIO;ROMA;ROMA;15717872.0;REGIONE AUTONOMA DELLA SICILIA;programmazione / progetto attivo;ATTIVO;https://www.opencup.gov.it/portale/progetto/-/cup/G86I22000180008
100;G41G22000010005;IMPIANTI DI ILLUMINAZIONE PUBBLICA E SEMAFORICI PER REALIZZAZIONE E GESTIONE DI INFRASTRUTTURE FINALIZZATE ALLEROGAZIONE DI SERVIZI SMART CITY;Riqualificazione urbana;TOSCANA;LUCCA;PIETRASANTA;15656992.0;COMUNE DI PIETRASANTA - LU -;programmazione / progetto attivo;ATTIVO;https://www.opencup.gov.it/portale/progetto/-/cup/G41G22000010005
100;H26G98000010001;LAVORI DI RISANAMENTO IDRAULICO AREA DI NOVOLI - I STRALCIO;Ambiente / rifiuti / depurazione;TOSCANA;FIRENZE;FIRENZE;15640380.0;COMUNE DI FIRENZE - FI -;chiuso;CHIUSO;https://www.opencup.gov.it/portale/progetto/-/cup/H26G98000010001
100;H77H25000980001;VIABILITÀ REGIONALI E PROVINCIALI DI COMPETENZA PROVINCIALE;Infrastrutture / parcheggi;TOSCANA;PISTOIA;TUTTI;15600000.0;AMMINISTRAZIONE PROVINCIALE DI PISTOIA;programmazione / progetto attivo;ATTIVO;https://www.opencup.gov.it/portale/progetto/-/cup/H77H25000980001
100;I18I21000790006;RIQUALIFICAZIONE IMMOBILE ERP VIA FELICE FERRI - VIA PRINCIPE AMEDEO;Riqualificazione urbana;LAZIO;ROMA;FRASCATI;15600000.0;COMUNE DI FRASCATI - ROMA -;programmazione / progetto attivo;ATTIVO;https://www.opencup.gov.it/portale/progetto/-/cup/I18I21000790006
100;F78E18000370006;LAVORI DI REALIZZAZIONE DI UN NUOVO CAMPUS SCOLASTICO;Scuole / formazione;LAZIO;LATINA;SAN FELICE CIRCEO;15589091.0;COMUNE DI SAN FELICE CIRCEO - LATINA -;programmazione / progetto attivo;ATTIVO;https://www.opencup.gov.it/portale/progetto/-/cup/F78E18000370006
100;C57H21000990001;DISSESTI URGENTI TRATTI STRADE COMUNALI EXTRAURBANE;Infrastrutture / parcheggi;MARCHE;MACERATA;PIEVE TORINA;15578570.0;COMUNE DI PIEVE TORINA - MC -;programmazione / progetto attivo;ATTIVO;https://www.opencup.gov.it/portale/progetto/-/cup/C57H21000990001
100;C57H21010010001;INTERVENTO DI RIPRISTINO DISSESTI STRADALI INTERO TERRITORIO COMUNALE;Infrastrutture / parcheggi;MARCHE;MACERATA;PIEVE TORINA;15578570.0;COMUNE DI PIEVE TORINA - MC -;programmazione / progetto attivo;ATTIVO;https://www.opencup.gov.it/portale/progetto/-/cup/C57H21010010001
100;G54H25000340002;RIQUALIFICAZIONE, EFFICIENTAMENTO ENERGETICO E GESTIONE DEGLI IMPIANTI DI PUBBLICA ILLUMINAZIONE DEL COMUNE DI CAPANNORI;Riqualificazione urbana;TOSCANA;LUCCA;CAPANNORI;15570400.0;COMUNE DI CAPANNORI - LU -;programmazione / progetto attivo;ATTIVO;https://www.opencup.gov.it/portale/progetto/-/cup/G54H25000340002
100;D88B23001350005;MANUTENZIONE STRAORDINARIA E POTENZIAMENTO LINEE FOGNARIE NEL COMUNE DI VITERBO;Ambiente / rifiuti / depurazione;LAZIO;VITERBO;VITERBO;15570019.0;COMUNE DI VITERBO - VT -;programmazione / progetto attivo;ATTIVO;https://www.opencup.gov.it/portale/progetto/-/cup/D88B23001350005
100;H83E23000290001;EDIFICIO PRODUTTIVO RICONDUCIBILE AD ABITATIVO;Residenziale pubblico / ERS;MARCHE;MACERATA;MACERATA;15525398.0;UFFICIO SPECIALE PER LA RICOSTRUZIONE POST SISMA DEL 2016 DELLA REGIONE MARCHE;programmazione / progetto attivo;ATTIVO;https://www.opencup.gov.it/portale/progetto/-/cup/H83E23000290001
100;F16B12000010002;INTERVENTI DI POTABILIZZAZIONE DELLE ACQUE NELL'AMBITO TERRITORIALE OTTIMALE N. 1 - VITERBO;Ambiente / rifiuti / depurazione;LAZIO;VITERBO;TUTTI;15500000.0;REGIONE LAZIO;programmazione / progetto attivo;ATTIVO;https://www.opencup.gov.it/portale/progetto/-/cup/F16B12000010002
100;E41B06000410002;STRADE STATALI 155 E 156;Infrastrutture / parcheggi;LAZIO;FROSINONE;FROSINONE;15493707.0;COMUNE DI FROSINONE - FR -;programmazione / progetto attivo;ATTIVO;https://www.opencup.gov.it/portale/progetto/-/cup/E41B06000410002
100;B19H10000480009;RETE STRADALE AREA METROPOLITANA;Infrastrutture / parcheggi;TOSCANA;FIRENZE;FIRENZE;15492000.0;CITTA' METROPOLITANA DI FIRENZE;programmazione / progetto attivo;ATTIVO;https://www.opencup.gov.it/portale/progetto/-/cup/B19H10000480009
100;I65F22000500003;AZIENDA OSPEDALIERA UNIVERSITARIA SENESE OSPEDALE SANTA MARIA ALLE SCOTTE;Sanità / RSA;TOSCANA;SIENA;SIENA;15444800.0;AZIENDA OSPEDALIERA UNIVERSITARIA SENESE;programmazione / progetto attivo;ATTIVO;https://www.opencup.gov.it/portale/progetto/-/cup/I65F22000500003
100;J81B22003070001;SMALL FORWARD PRODUCTIONS SPA;Cultura / centri civici;LAZIO;ROMA;ROMA;15441902.0;REGIONE PIEMONTE;programmazione / progetto attivo;ATTIVO;https://www.opencup.gov.it/portale/progetto/-/cup/J81B22003070001
100;H43D25000130005;SP 4 ARRONESE;Infrastrutture / parcheggi;UMBRIA;TERNI;ARRONE;15381709.0;COMUNE DI ARRONE - TERNI -;programmazione / progetto attivo;ATTIVO;https://www.opencup.gov.it/portale/progetto/-/cup/H43D25000130005
100;B97B16000030003;NUOVA SEDE LICEO AGNOLETTI;Residenziale pubblico / ERS;TOSCANA;FIRENZE;SESTO FIORENTINO;15348848.0;CITTA' METROPOLITANA DI FIRENZE;programmazione / progetto attivo;ATTIVO;https://www.opencup.gov.it/portale/progetto/-/cup/B97B16000030003
100;B36G15000570004;COMUNE DI ROCCA DI PAPA - ROMA;Riqualificazione urbana;LAZIO;ROMA;ROCCA DI PAPA;15320668.0;COMUNE DI ROCCA DI PAPA - ROMA -;chiuso;CHIUSO;https://www.opencup.gov.it/portale/progetto/-/cup/B36G15000570004
100;B59D10000240007;REALIZZAZIONE OPERE E LAVORI PER L'ATTUAZIONE DEL PROGRAMMA URBANISTICO 02 - S. NICOLÒ DI CELLE;Scuole / formazione;UMBRIA;PERUGIA;DERUTA;15300000.0;COMUNE DI DERUTA - PERUGIA -;chiuso;CHIUSO;https://www.opencup.gov.it/portale/progetto/-/cup/B59D10000240007
100;B17H21006990001;INTERVENTI DI MANUTENZIONE STRAORDINARIA PER LA MESSA IN SICUREZZA DEI PONTI E VIADOTTI ESISTENTI E PER LA REALIZZAZIONE DI NUOVI PONTI IN SOSTITUZIONE DI QUELLI ESISTENTI CON PROBLEMI STRUTTURALI DI SICUREZZA - ANNI 2021 - 2022 - 2023 - DM 225/2021;Infrastrutture / parcheggi;TOSCANA;FIRENZE;FIRENZE;15287033.0;CITTA' METROPOLITANA DI FIRENZE;programmazione / progetto attivo;ATTIVO;https://www.opencup.gov.it/portale/progetto/-/cup/B17H21006990001
100;D73D21000360005;COMPENDIO SAN BENEDETTO - EX OSPEDALE PSICHIATRICO DI PESARO;Scuole / formazione;MARCHE;PESARO E URBINO;PESARO;15250000.0;COMUNE DI PESARO - PS -;programmazione / progetto attivo;ATTIVO;https://www.opencup.gov.it/portale/progetto/-/cup/D73D21000360005
100;F32J10000240002;SPIAGGIA DI BAZZANO;Ambiente / rifiuti / depurazione;LAZIO;LATINA;SPERLONGA;15230000.0;REGIONE LAZIO;chiuso;CHIUSO;https://www.opencup.gov.it/portale/progetto/-/cup/F32J10000240002
100;B41B21007580003;STRADA LUNGOTENNA DA SAN MARCO A SVINCOLO A14 PORTO SANT'ELPIDIO;Infrastrutture / parcheggi;MARCHE;FERMO;PORTO SANT'ELPIDIO;15200000.0;REGIONE MARCHE;programmazione / progetto attivo;ATTIVO;https://www.opencup.gov.it/portale/progetto/-/cup/B41B21007580003
100;I83D16000840005;RIQUALIFICAZIONE DEL CENTRO FIERE DI VILLA POTENZA;Riqualificazione urbana;MARCHE;MACERATA;MACERATA;15176200.0;COMUNE DI MACERATA - MC -;programmazione / progetto attivo;ATTIVO;https://www.opencup.gov.it/portale/progetto/-/cup/I83D16000840005
100;E86J11000080004;STRADA C.LE DI STRACCOLIGNO STRADA C.LE DI NAREGNO;Infrastrutture / parcheggi;TOSCANA;LIVORNO;CAPOLIVERI;15108960.0;COMUNE DI CAPOLIVERI - LIVORNO -;chiuso;CHIUSO;https://www.opencup.gov.it/portale/progetto/-/cup/E86J11000080004
100;F59J21003190006;QUADRO STRATEGICO ED OPERATIVO URBANISTICO E PAESAGGISTICO PER IL RECUPERO L'ACCESSIBILITA' E LA VALORIZZAZIONE NELL'AMBITO TERRITORIALE DELL'ECOSISTEMA DELLE MARCITE DI NORCIA;Riqualificazione urbana;UMBRIA;PERUGIA;NORCIA;15070000.0;COMUNE DI NORCIA - PG -;programmazione / progetto attivo;ATTIVO;https://www.opencup.gov.it/portale/progetto/-/cup/F59J21003190006
100;D87H16001230004;RISTRUTTURAZIONE PAVIMENTAZIONI IN CONGLOMERATO;Infrastrutture / parcheggi;LAZIO;VITERBO;VITERBO;15059000.0;COMUNE DI VITERBO - VT -;programmazione / progetto attivo;ATTIVO;https://www.opencup.gov.it/portale/progetto/-/cup/D87H16001230004
100;B36G21002600001;RIQUALIFICAZIONE DEL CENTRO STORICO DI URBINO E FRAZIONE DI CANAVACCIO CON IL RIUTILIZZO DI AREA INDUSTRIALE DA DESTINARE A SPAZI PER ISTRUZIONE, CULTURA, ALLOGGI POPOLARI E SPAZI SOCIALI;Riqualificazione urbana;MARCHE;PESARO E URBINO;URBINO;15000150.0;COMUNE DI URBINO - PESARO E URBINO -;programmazione / progetto attivo;ATTIVO;https://www.opencup.gov.it/portale/progetto/-/cup/B36G21002600001
100;B22G11000010004;AREA TERME DI FOGLIANO;Ambiente / rifiuti / depurazione;LAZIO;LATINA;LATINA;15000020.0;COMUNE DI LATINA - LT -;programmazione / progetto attivo;ATTIVO;https://www.opencup.gov.it/portale/progetto/-/cup/B22G11000010004
100;G81B21000040005;OSTIA IDROSCALO - INTERVENTO DI NUOVA COSTRUZIONE - ROMA MUNICIPIO X - VIA DOMENICO BAFFIGO, VIA MARIO RUTA, VIA FRANCO STORELLI E VIA ANTONIO FORMI;Edilizia pubblica;LAZIO;ROMA;ROMA;15000000.0;AZIENDA TERRITORIALE PER L'EDILIZIA RESIDENZIALE PUBBLICA DEL COMUNE DI ROMA;programmazione / progetto attivo;ATTIVO;https://www.opencup.gov.it/portale/progetto/-/cup/G81B21000040005
100;D91B18000030001;VARIANTE ALLA SRT 71 - TRATTO TRA SUBBIANO NORD E CALBENZANO - COMUNE DI SUBBIANO;Infrastrutture / parcheggi;TOSCANA;AREZZO;SUBBIANO;15000000.0;REGIONE TOSCANA;programmazione / progetto attivo;ATTIVO;https://www.opencup.gov.it/portale/progetto/-/cup/D91B18000030001
100;J23E12000000004;IMPIANTO PUBBLICO PER LA PRODUZIONE E DISTRIBUZIONE DI ACQUA NATURALE REFRIGERATA E DEARSENIFICATA - INSTALLAZIONE MANUFATTI PREFABBRICATI;Ambiente / rifiuti / depurazione;LAZIO;VITERBO;MONTALTO DI CASTRO;15000000.0;COMUNE DI MONTALTO DI CASTRO - VT -;programmazione / progetto attivo;ATTIVO;https://www.opencup.gov.it/portale/progetto/-/cup/J23E12000000004
100;F87B15000160005;FIUME TEVERE;Ambiente / rifiuti / depurazione;LAZIO;ROMA;ROMA;15000000.0;REGIONE LAZIO;programmazione / progetto attivo;ATTIVO;https://www.opencup.gov.it/portale/progetto/-/cup/F87B15000160005
100;E32E22000560006;FOGNATURE ACQUE METEORICHE ZONA SUD;Infrastrutture / parcheggi;MARCHE;PESARO E URBINO;FANO;15000000.0;COMUNE DI FANO - PS -;programmazione / progetto attivo;ATTIVO;https://www.opencup.gov.it/portale/progetto/-/cup/E32E22000560006
100;G21B18000450007;VARIANTE IN LOCALITA' TROGHI E OPERE DI COMPLETAMENTO DELLA MOBILITA';Infrastrutture / parcheggi;TOSCANA;FIRENZE;RIGNANO SULL'ARNO;15000000.0;COMUNE DI RIGNANO SULL'ARNO - FIRENZE -;programmazione / progetto attivo;ATTIVO;https://www.opencup.gov.it/portale/progetto/-/cup/G21B18000450007
100;F13D21002220001;QUALITÀ DELL'ABITARE - RIQUALIFICAZIONE DEL QUARTIERE CITTÀ GIARDINO;Riqualificazione urbana;LAZIO;RIETI;RIETI;15000000.0;COMUNE DI RIETI - RI -;programmazione / progetto attivo;ATTIVO;https://www.opencup.gov.it/portale/progetto/-/cup/F13D21002220001
100;B16B19000040003;SOSTITUZIONE EDILIZIA ISTITUTO GALILEO GALILEI;Scuole / formazione;TOSCANA;FIRENZE;FIRENZE;15000000.0;CITTA' METROPOLITANA DI FIRENZE;programmazione / progetto attivo;ATTIVO;https://www.opencup.gov.it/portale/progetto/-/cup/B16B19000040003
