score;cup;title;category;region;province;municipality;value_eur;client;phase;status;source_url
100;F41B03000160002;EX S.S. N°71 UMBRO-CASENTINESE. LAVORI DI COSTRUZIONE MURO DI CONTENIMENTO AL KM 63+000.;Infrastrutture / parcheggi;UMBRIA;TERNI;MONTELEONE D'ORVIETO;44746700.0;AMMINISTRAZIONE PROVINCIALE DI TERNI;chiuso;CHIUSO;https://www.opencup.gov.it/portale/progetto/-/cup/F41B03000160002
100;F85J05000030004;RISANAMENTO LASTRICO SOLARE SCUOLA MEDIA GIOVANNI PASCOLI;Scuole / formazione;LAZIO;RIETI;RIETI;44476000.0;COMUNE DI RIETI - RI -;programmazione / progetto attivo;ATTIVO;https://www.opencup.gov.it/portale/progetto/-/cup/F85J05000030004
100;E37H03000230002;STRADA GRANDE COMUNICAZIONE FIRENZE PISA LIVORNO;Infrastrutture / parcheggi;TOSCANA;PISA;CASCINA;44120000.0;AMMINISTRAZIONE PROVINCIALE DI PISA;programmazione / progetto attivo;ATTIVO;https://www.opencup.gov.it/portale/progetto/-/cup/E37H03000230002
100;B19J24002180005;CONTRATTO MISTO AVENTE AD OGGETTO IL SERVIZIO DI GLOBAL SERVICE PER LA GESTIONE E MANUTENZIONE DELLA SGC FIPILI;Infrastrutture / parcheggi;TOSCANA;FIRENZE;FIRENZE;43800000.0;CITTA' METROPOLITANA DI FIRENZE;programmazione / progetto attivo;ATTIVO;https://www.opencup.gov.it/portale/progetto/-/cup/B19J24002180005
100;B87H04000820004;manutenzione straordinaria di guard-rail e spallette di ponti su strade comunali;Infrastrutture / parcheggi;TOSCANA;AREZZO;AREZZO;43700000.0;COMUNE DI AREZZO - AR -;chiuso;CHIUSO;https://www.opencup.gov.it/portale/progetto/-/cup/B87H04000820004
100;F45B22000500007;STADIO LIBERO LIBERATI;Sport / impianti sportivi;UMBRIA;TERNI;TERNI;43608000.0;COMUNE DI TERNI - TR -;programmazione / progetto attivo;ATTIVO;https://www.opencup.gov.it/portale/progetto/-/cup/F45B22000500007
100;C57H21010040001;RIPRISTINO SOTTOSERVIZI ACQUEDOTTO, FOGNATURE E PUBBLICA ILLUMINAZIONE FRAZIONI VERSANTE RAMO CHIENTI (26 FRAZIONI);Sanità / RSA;MARCHE;MACERATA;PIEVE TORINA;43484848.0;COMUNE DI PIEVE TORINA - MC -;programmazione / progetto attivo;ATTIVO;https://www.opencup.gov.it/portale/progetto/-/cup/C57H21010040001
100;B41B23000590003;VARIANTE SS16 FANO-MAROTTA (1° STRALCIO);Infrastrutture / parcheggi;MARCHE;PESARO E URBINO;FANO;43000000.0;REGIONE MARCHE;programmazione / progetto attivo;ATTIVO;https://www.opencup.gov.it/portale/progetto/-/cup/B41B23000590003
100;C13J04000050002;Lavori di completamento delle opere sulla via Cascina in frazione di Bozzano (inserite nei lavori di completamento della fognatura nera in varie frazioni) eseguiti in somma urgenza.;Ambiente / rifiuti / depurazione;TOSCANA;LUCCA;MASSAROSA;43000000.0;COMUNE DI MASSAROSA - LU -;chiuso;CHIUSO;https://www.opencup.gov.it/portale/progetto/-/cup/C13J04000050002
100;H67H04000340005;sistemazione della pavimentazione strade comunali -Viale Kennedy-Via Colle Mezzopane-Via Genazzano-Via Colle Acqua Maggio;Infrastrutture / parcheggi;LAZIO;ROMA;VALMONTONE;42865000.0;COMUNE DI VALMONTONE - RM -;chiuso;CHIUSO;https://www.opencup.gov.it/portale/progetto/-/cup/H67H04000340005
100;F65E22000140001;REALIZZAZIONE DEL NUOVO POLO SCOLASTICO IN TREVIGNANO ROMANO;Scuole / formazione;LAZIO;ROMA;TREVIGNANO ROMANO;42710595.0;COMUNE DI TREVIGNANO ROMANO - ROMA -;programmazione / progetto attivo;ATTIVO;https://www.opencup.gov.it/portale/progetto/-/cup/F65E22000140001
100;F85F07001480002;REGIONE LAZIO - DIREZIONE REGIONALE REGIONE LAZIO-DIREZIONE REGIONALE AMBIENTE E COOPERAZIONE TRA I POPOLI -AREA DIFESA DEL SUOLO AREE NATURALI PROTETTE REGIONALI;Riqualificazione urbana;LAZIO;TUTTE;TUTTI;41637980.0;REGIONE LAZIO;chiuso;CHIUSO D'UFFICIO;https://www.opencup.gov.it/portale/progetto/-/cup/F85F07001480002
100;D46E11000140003;PALESTRA DEL POLO DIDATTICO DI POGGIO MIRTETO;Sport / impianti sportivi;LAZIO;RIETI;POGGIO MIRTETO;41174090.0;AMMINISTRAZIONE PROVINCIALE DI RIETI;chiuso;CHIUSO;https://www.opencup.gov.it/portale/progetto/-/cup/D46E11000140003
100;F93G22000030001;38 POLI CIVICI CULTURALI NEI COMUNI DELLAREA METROPOLITANA.;Riqualificazione urbana;LAZIO;ROMA;RIOFREDDO;40975000.0;CITTA' METROPOLITANA DI ROMA CAPITALE;programmazione / progetto attivo;ATTIVO;https://www.opencup.gov.it/portale/progetto/-/cup/F93G22000030001
100;E51B22000710006;COSTRUZIONE DI NUOVO EDIFICIO SCOLASTICO IN SOSTITUZIONE DEL CONCETTO MARCHESI DI PISA;Scuole / formazione;TOSCANA;PISA;PISA;40895000.0;AMMINISTRAZIONE PROVINCIALE DI PISA;programmazione / progetto attivo;ATTIVO;https://www.opencup.gov.it/portale/progetto/-/cup/E51B22000710006
100;B89I24000510007;AFFIDAMENTO IN CONCESSIONE, TRAMITE FINANZA DI PROGETTO A TERMINI DELLART 193 CO. 1 DEL D.LGS. 36/2023 , DEI LAVORI DI RIQUALIFICAZIONE DI ALCUNE VIABILITA DEL CAPOLUOGO GESTIONE PARCHEGGI;Riqualificazione urbana;TOSCANA;PISA;PONTEDERA;40727017.0;COMUNE DI PONTEDERA - PI -;programmazione / progetto attivo;ATTIVO;https://www.opencup.gov.it/portale/progetto/-/cup/B89I24000510007
100;F85J05000050004;manutenzione straordinaria per la sistemazione copertura scuola materna Borgo Ovest;Scuole / formazione;LAZIO;RIETI;RIETI;40450000.0;COMUNE DI RIETI - RI -;programmazione / progetto attivo;ATTIVO;https://www.opencup.gov.it/portale/progetto/-/cup/F85J05000050004
100;C99D09000130002;PROGETTAZIONE E RIQUALIFICAZIONE URBANA E TERRITORIALE ATTRAVERSO IL RIUSO COORDINATO DI EDIFICI E STRUTTURE;Riqualificazione urbana;TOSCANA;SIENA;POGGIBONSI;40187354.0;COMUNE DI COLLE DI VAL D'ELSA - SI -;chiuso;CHIUSO;https://www.opencup.gov.it/portale/progetto/-/cup/C99D09000130002
100;B86F25000060002;INTERVENTI PER LA MITIGAZIONE DEL RISCHIO IDRAULICO SUL DEL F. ELSA NEL TRATTO TRA CERTALDO ED EMPOLI;Ambiente / rifiuti / depurazione;TOSCANA;FIRENZE;CERTALDO;40170208.0;UNIONE DEI COMUNI CIRCONDARIO DELL'EMPOLESE VALDELSA;programmazione / progetto attivo;ATTIVO;https://www.opencup.gov.it/portale/progetto/-/cup/B86F25000060002
100;B61B23000610001;CONNESSIONE INTERVALLIVA TRA SS76 E E78 - SERRA S.ABBONDIO-CAGLI - LOTTO 3C CONNESSIONE SS3-SS424;Infrastrutture / parcheggi;MARCHE;PESARO E URBINO;CAGLI;40000000.0;REGIONE MARCHE;programmazione / progetto attivo;ATTIVO;https://www.opencup.gov.it/portale/progetto/-/cup/B61B23000610001
100;G82D22002880005;ACCORDO QUADRO PER L'AFFIDAMENTO DI INTERVENTI DI MANUTENZIONE ORDINARIA, STRAORDINARIA E RIQUALIFICAZIONE SUGLI IMMOBILI DI PROPRIETA' E/O IN GESTIONE ATER DEL COMUNE DI ROMA DIVISO IN N. 6 LOTTI DURATA 4 ANNI;Riqualificazione urbana;LAZIO;ROMA;ROMA;40000000.0;AZIENDA TERRITORIALE PER L'EDILIZIA RESIDENZIALE PUBBLICA DEL COMUNE DI ROMA;programmazione / progetto attivo;ATTIVO;https://www.opencup.gov.it/portale/progetto/-/cup/G82D22002880005
100;F16E11000540005;PROGETTO PER LA SOSTITUZIONE DELLA PAVIMENTAZIONE ESISTENTE NEL PERCORSO PEDONALE TRA PONTE ROMANO E PONTE GIOVANNI XIII NEL COMUNE DI RIETI E MANUTENZIONE DEL PONTE ROMANO.;Infrastrutture / parcheggi;LAZIO;RIETI;RIETI;39854400.0;COMUNE DI RIETI - RI -;programmazione / progetto attivo;ATTIVO;https://www.opencup.gov.it/portale/progetto/-/cup/F16E11000540005
100;G11H07000020006;FORMAZIONE DEL PIANO PARTICOLAREGGIATO PER IL RECUPERO DEL CENTRO STORICO;Scuole / formazione;LAZIO;FROSINONE;SAN DONATO VAL DI COMINO;39698000.0;COMUNE DI SAN DONATO VAL DI COMINO - FROSINONE -;chiuso;CHIUSO;https://www.opencup.gov.it/portale/progetto/-/cup/G11H07000020006
100;I35G11000020002;RECUPERO E VALORIZZAZIONE TURISTICO AMBIENTALE SPONDE TORRENTE CSTAELLANO;Ambiente / rifiuti / depurazione;MARCHE;ASCOLI PICENO;ASCOLI PICENO;39666550.0;AMMINISTRAZIONE PROVINCIALE DI ASCOLI PICENO;chiuso;CHIUSO;https://www.opencup.gov.it/portale/progetto/-/cup/I35G11000020002
100;D32I03000010004;IGIENE URBANA;Ambiente / rifiuti / depurazione;LAZIO;ROMA;FONTE NUOVA;39527000.0;COMUNE DI FONTE NUOVA - ROMA -;programmazione / progetto attivo;ATTIVO;https://www.opencup.gov.it/portale/progetto/-/cup/D32I03000010004
100;C72G04000080004;Rifacimento Impianti elettrici in vari edifici Scolastici. Lotto n° 3 Scuola elementare di Ramini.;Scuole / formazione;TOSCANA;PISTOIA;PISTOIA;39000000.0;COMUNE DI PISTOIA - PT -;chiuso;CHIUSO;https://www.opencup.gov.it/portale/progetto/-/cup/C72G04000080004
100;F49G13000240003;FIUME LIRI;Ambiente / rifiuti / depurazione;LAZIO;FROSINONE;CASTELLIRI;38866130.0;REGIONE LAZIO;programmazione / progetto attivo;ATTIVO;https://www.opencup.gov.it/portale/progetto/-/cup/F49G13000240003
100;B19J21003910005;CONTRATTO MISTO AVENTE AD OGGETTO IL SERVIZIO DI GLOBAL SERVICE PER LA GESTIONE E MANUTENZIONE DELLA SGC FIPILI DELL'IMPORTO A BASE DI GARA DI EURO 12.566.880,74 (COMPRESO ONERI PER LA SICUREZZA);Infrastrutture / parcheggi;TOSCANA;FIRENZE;FIRENZE;38807372.0;CITTA' METROPOLITANA DI FIRENZE;programmazione / progetto attivo;ATTIVO;https://www.opencup.gov.it/portale/progetto/-/cup/B19J21003910005
100;B73B08000130007;PIANO TELEMATICO REGIONALE;Scuole / formazione;MARCHE;TUTTE;TUTTI;38504500.0;REGIONE MARCHE;programmazione / progetto attivo;ATTIVO;https://www.opencup.gov.it/portale/progetto/-/cup/B73B08000130007
100;F91B11000450004;INTERO TERRITORIO COMUNALE;Infrastrutture / parcheggi;LAZIO;ROMA;GUIDONIA MONTECELIO;38500000.0;COMUNE DI GUIDONIA MONTECELIO - ROMA -;programmazione / progetto attivo;ATTIVO;https://www.opencup.gov.it/portale/progetto/-/cup/F91B11000450004
100;F93D11000430004;INTERO TERRITORIO COMUNALE;Infrastrutture / parcheggi;LAZIO;ROMA;GUIDONIA MONTECELIO;38500000.0;COMUNE DI GUIDONIA MONTECELIO - ROMA -;programmazione / progetto attivo;ATTIVO;https://www.opencup.gov.it/portale/progetto/-/cup/F93D11000430004
100;F33H08000000003;ADDUTTRICI, RETI FOGNARIE E DEPURATORE;Sanità / RSA;LAZIO;ROMA;TUTTI;37510000.0;REGIONE LAZIO;programmazione / progetto attivo;ATTIVO;https://www.opencup.gov.it/portale/progetto/-/cup/F33H08000000003
100;I88G12000050002;IPSIA ITC PALESTRA;Sport / impianti sportivi;TOSCANA;AREZZO;FOIANO DELLA CHIANA;36650000.0;AMMINISTRAZIONE PROVINCIALE DI AREZZO;programmazione / progetto attivo;ATTIVO;https://www.opencup.gov.it/portale/progetto/-/cup/I88G12000050002
100;J41B23000350004;OPERA SOSTITUTIVA SOTTOPASSO DEL CAVALCAFERROVIA LINEA TIRRENICA VIA DEGLI ACQUEDOTTI;Infrastrutture / parcheggi;TOSCANA;LIVORNO;LIVORNO;36168000.0;COMUNE DI LIVORNO - LI -;programmazione / progetto attivo;ATTIVO;https://www.opencup.gov.it/portale/progetto/-/cup/J41B23000350004
100;B61B21006470003;S.S. 77 - S.S. 16;Infrastrutture / parcheggi;MARCHE;FERMO;SANT'ELPIDIO A MARE;35900000.0;REGIONE MARCHE;programmazione / progetto attivo;ATTIVO;https://www.opencup.gov.it/portale/progetto/-/cup/B61B21006470003
100;H11B20001310004;SISTEMA TRANVIARIO - LINEA 4 LEOPOLDA - REALIZZAZIONE VIABILITÀ PIAGGE, PISTOIESE - ROSSELLI E SCAMBIATORE INDIANO;Infrastrutture / parcheggi;TOSCANA;FIRENZE;FIRENZE;35384298.0;COMUNE DI FIRENZE - FI -;programmazione / progetto attivo;ATTIVO;https://www.opencup.gov.it/portale/progetto/-/cup/H11B20001310004
100;F55C14000010004;COMUNE DI ANZIO;Ambiente / rifiuti / depurazione;LAZIO;ROMA;ANZIO;35284275.0;COMUNE DI ANZIO - RM -;programmazione / progetto attivo;ATTIVO;https://www.opencup.gov.it/portale/progetto/-/cup/F55C14000010004
100;E76J25000030007;PIANO STRATEGICO PER IL RECUPERO E LO SVILUPPO DELL'AREA DELLA EX-POLVERIERA IN LOCALITA' CARRAIA, ZONA POGGIO FARNETO - CALENZANO;Residenziale pubblico / ERS;TOSCANA;FIRENZE;CALENZANO;35093016.0;COMUNE DI CALENZANO - FI -;programmazione / progetto attivo;ATTIVO;https://www.opencup.gov.it/portale/progetto/-/cup/E76J25000030007
100;C44F22000060005;LOTTO 2 EDIFICI NEI COMUNI DI LIVORNO, CECINA E PORTOFERRAIO;Riqualificazione urbana;TOSCANA;LIVORNO;LIVORNO;35001109.0;CASA LIVORNO E PROVINCIA S.P.A.;programmazione / progetto attivo;ATTIVO;https://www.opencup.gov.it/portale/progetto/-/cup/C44F22000060005
100;I97H03000230003;S.P. n. 93 Venarottese. Lavori di urgenza per la sistemazione e consolidamento del corpo stradale a seguito di movimenti franosi.;Infrastrutture / parcheggi;MARCHE;ASCOLI PICENO;VENAROTTA;35000000.0;AMMINISTRAZIONE PROVINCIALE DI ASCOLI PICENO;chiuso;CHIUSO;https://www.opencup.gov.it/portale/progetto/-/cup/I97H03000230003
100;B81B23000590003;NUOVA REALIZZAZIONE BRETELLA DI OSIMO (AN).;Infrastrutture / parcheggi;MARCHE;ANCONA;OSIMO;35000000.0;REGIONE MARCHE;programmazione / progetto attivo;ATTIVO;https://www.opencup.gov.it/portale/progetto/-/cup/B81B23000590003
100;D66B17000000001;REALIZZAZIONE DEL BY-PASS IDRAULICO TORANO-GRAGNANA;Ambiente / rifiuti / depurazione;TOSCANA;MASSA-CARRARA;MASSA;35000000.0;REGIONE TOSCANA;programmazione / progetto attivo;ATTIVO;https://www.opencup.gov.it/portale/progetto/-/cup/D66B17000000001
100;B61B03000280006;S.R.T. N. 2 VIA CASSIA;Infrastrutture / parcheggi;TOSCANA;SIENA;MONTERONI D'ARBIA;34891000.0;AMMINISTRAZIONE PROVINCIALE DI SIENA;programmazione / progetto attivo;ATTIVO;https://www.opencup.gov.it/portale/progetto/-/cup/B61B03000280006
100;D52J09000010005;ANATOMIA PATOLOGICA SO CISANELLO;Edilizia pubblica;TOSCANA;PISA;PISA;34359000.0;AZIENDA OSPEDALIERA PISANA;chiuso;CHIUSO;https://www.opencup.gov.it/portale/progetto/-/cup/D52J09000010005
100;B36J14000060003;PISCINA COMUNALE;Sport / impianti sportivi;UMBRIA;PERUGIA;SPOLETO;34077229.0;COMUNE DI SPOLETO - PG -;chiuso;CHIUSO;https://www.opencup.gov.it/portale/progetto/-/cup/B36J14000060003
100;H84G99000000006;Completamento Ospedale San Donato di Arezzo;Sanità / RSA;TOSCANA;AREZZO;AREZZO;34016785.0;AZIENDA USL8 AREZZO;programmazione / progetto attivo;ATTIVO;https://www.opencup.gov.it/portale/progetto/-/cup/H84G99000000006
100;B91B23000650005;STRADA REGIONALE 69;Infrastrutture / parcheggi;TOSCANA;FIRENZE;FIGLINE E INCISA VALDARNO;34000000.0;CITTA' METROPOLITANA DI FIRENZE;programmazione / progetto attivo;ATTIVO;https://www.opencup.gov.it/portale/progetto/-/cup/B91B23000650005
100;I89I21000260001;COMUNE DI ROMA;Riqualificazione urbana;LAZIO;ROMA;ROMA;33668142.0;AGENZIA PER I TRASPORTI AUTOFERROTRAMVIARI DEL COMUNE DI ROMA;programmazione / progetto attivo;ATTIVO;https://www.opencup.gov.it/portale/progetto/-/cup/I89I21000260001
100;H28C05000020002;SISTEMAZIONE ESTERNI E COMPLETAMENTO DEL MUSEO DELLA CIVILTA¿ DEL BOSCO E DELLA MONTAGNA;Cultura / centri civici;TOSCANA;FIRENZE;REGGELLO;33600000.0;COMUNE DI REGGELLO - FI -;chiuso;CHIUSO;https://www.opencup.gov.it/portale/progetto/-/cup/H28C05000020002
100;C35F21000210008;INTERVENTO DI RECUPERO DI PALAZZO SALADINI PILASTRI;Sanità / RSA;MARCHE;ASCOLI PICENO;ASCOLI PICENO;33411252.0;COMUNE DI ASCOLI PICENO - AP -;programmazione / progetto attivo;ATTIVO;https://www.opencup.gov.it/portale/progetto/-/cup/C35F21000210008
100;G79D07000100007;PROJECT FINANCING PER LA REALIZZAZIONE DELLA STAZIONE TRAMVIA VELOCE FIRENZE SMN SCANDICCI E NUOVO CENTRO CIVICO;Cultura / centri civici;TOSCANA;FIRENZE;SCANDICCI;33339918.0;COMUNE DI SCANDICCI - FI -;chiuso;CHIUSO;https://www.opencup.gov.it/portale/progetto/-/cup/G79D07000100007
100;B71B02000140006;S.R. 429 DI VAL D'ELSA VARIANTE DELLA STRADA REGIONALE 429 DI VAL D¿ELSA PER IL COLLEGAMENTO DEI CENTRI ABITATI DI CERTALDO E POGGIBONSI;Infrastrutture / parcheggi;TOSCANA;SIENA;SAN GIMIGNANO;33100000.0;AMMINISTRAZIONE PROVINCIALE DI SIENA;programmazione / progetto attivo;ATTIVO;https://www.opencup.gov.it/portale/progetto/-/cup/B71B02000140006
100;D27H06000620004;Opere di completamento manutenzione strade comunali 6 stralcio;Infrastrutture / parcheggi;TOSCANA;MASSA-CARRARA;MONTIGNOSO;33082760.0;COMUNE DI MONTIGNOSO - MS -;chiuso;CHIUSO;https://www.opencup.gov.it/portale/progetto/-/cup/D27H06000620004
100;B18H25000880002;O.C.D.P.C. N. 922/2022 E 1011/2023 E S.M.I._EVENTI METEOROLOGICI VERIFICATISI NELLA REGIONE MARCHE A PARTIRE DAL GIORNO 15 SETTEMBRE 2022. MITIGAZIONE DEL RISCHIO IDRAULICO BACINO IDROGRAFICO MISA/NEVOLA.;Ambiente / rifiuti / depurazione;MARCHE;ANCONA;SENIGALLIA;33000000.0;REGIONE MARCHE;programmazione / progetto attivo;ATTIVO;https://www.opencup.gov.it/portale/progetto/-/cup/B18H25000880002
100;C13G25000040005;ADEGUAMENTO SISMICO EDIFICI APPARTENENTI AL COMPLESSO DELLA CHIESA DI S. DOMENICO ED ALTRI EDIFICI IN USO ALLA SCUOLA INTERFORZE PER LA DIFESA NBC  CASERMA VERDIROSI;Scuole / formazione;LAZIO;RIETI;RIETI;32960000.0;UFFICIO SPECIALE PER LA RICOSTRUZIONE POST SISMA DEL 2016 DELLA REGIONE LAZIO;programmazione / progetto attivo;ATTIVO;https://www.opencup.gov.it/portale/progetto/-/cup/C13G25000040005
100;I12C21000330001;IMMOBILE EX OSPEDALE S. FLORIDO, SITO IN CITTA' DI CASTELLO;Sanità / RSA;UMBRIA;PERUGIA;CITTA' DI CASTELLO;32665000.0;REGIONE UMBRIA;programmazione / progetto attivo;ATTIVO;https://www.opencup.gov.it/portale/progetto/-/cup/I12C21000330001
100;F43B03000010009;LITORALE DEI COMUNI DI SAN FELICE CIRCEO, TERRACINA, FONDI, FORMIA E MINTURNO;Ambiente / rifiuti / depurazione;LAZIO;LATINA;TUTTI;32444788.0;REGIONE LAZIO;chiuso;CHIUSO D'UFFICIO;https://www.opencup.gov.it/portale/progetto/-/cup/F43B03000010009
100;G11B22001380009;CICLOVIA;Infrastrutture / parcheggi;TOSCANA;MASSA-CARRARA;FOSDINOVO;32293480.0;REGIONE LIGURIA;programmazione / progetto attivo;ATTIVO;https://www.opencup.gov.it/portale/progetto/-/cup/G11B22001380009
100;D31J26000060007;CONCESSIONE TRAMITE FINANZA DI PROGETTO INTERVENTO DI RIQUALIFICAZ. URBANA E AMBIENTALE DI ALCUNE AREE A PARCHEGGIO, AMMODERNAM.SISTEMA DELLA SOSTA REGOLAMENTATA E GESTIONE SERVIZI DI SOSTA A PAGAMENTO E MOBILITY SHARING, NEL COMUNE DI CAMAIORE;Infrastrutture / parcheggi;TOSCANA;LUCCA;CAMAIORE;32052955.0;COMUNE DI CAMAIORE - LU -;programmazione / progetto attivo;ATTIVO;https://www.opencup.gov.it/portale/progetto/-/cup/D31J26000060007
100;B19J12000430003;S.G.C. FI PI LI;Infrastrutture / parcheggi;TOSCANA;FIRENZE;FIRENZE;32000000.0;CITTA' METROPOLITANA DI FIRENZE;programmazione / progetto attivo;ATTIVO;https://www.opencup.gov.it/portale/progetto/-/cup/B19J12000430003
100;B19J17000300005;S.G.C. FI PI LI VIA S.G.C. FI-PI-LI GLOBAL SERVICE DI GESTIONE E MANUTENZIONE DELLA S.G.C. FI-PI-LI;Infrastrutture / parcheggi;TOSCANA;FIRENZE;FIRENZE;32000000.0;CITTA' METROPOLITANA DI FIRENZE;programmazione / progetto attivo;ATTIVO;https://www.opencup.gov.it/portale/progetto/-/cup/B19J17000300005
100;H74B03000060013;Nuovo Ospedale territoriale di Todi - Marsciano Licitazione Privata per la realizzazione dei lavori;Sanità / RSA;UMBRIA;PERUGIA;TODI;31610870.0;AZIENDA USL UMBRIA 1;chiuso;CHIUSO;https://www.opencup.gov.it/portale/progetto/-/cup/H74B03000060013
100;C65I25000130001;REALIZZAZIONE DELLA NUOVA SEDE DELLA QUESTURA DI MASSA E DELLA SEZIONE DELLA POLIZIA STRADALE;Infrastrutture / parcheggi;TOSCANA;MASSA-CARRARA;MASSA;31570000.0;COMUNE DI MASSA - MS -;programmazione / progetto attivo;ATTIVO;https://www.opencup.gov.it/portale/progetto/-/cup/C65I25000130001
100;F16E11000180004;SCUOLA MEDIA A. M. RICCI;Scuole / formazione;LAZIO;RIETI;RIETI;31563000.0;COMUNE DI RIETI - RI -;programmazione / progetto attivo;ATTIVO;https://www.opencup.gov.it/portale/progetto/-/cup/F16E11000180004
100;G82F14000050005;AFFIDAMENTO DEI SERVIZI INTEGRATI DI PULIZIA, GIARDINAGGIO, IGIENE, BONIFICA E TUTELA AMBIENTALE NELLE AREE DI PERTINENZA DEI COMPLESSI EDILIZI DI PROPRIETÀ ED IN GESTIONE DELL'ATER DI ROMA, PER IL PERIODO DI 4 ANNI;Ambiente / rifiuti / depurazione;LAZIO;ROMA;ROMA;31489405.0;AZIENDA TERRITORIALE PER L'EDILIZIA RESIDENZIALE PUBBLICA DEL COMUNE DI ROMA;programmazione / progetto attivo;ATTIVO;https://www.opencup.gov.it/portale/progetto/-/cup/G82F14000050005
100;E26H08000030007;PALESTRA DI MORCIOLA;Sport / impianti sportivi;MARCHE;PESARO E URBINO;VALLEFOGLIA;31422000.0;COMUNE DI COLBORDOLO - PS -;chiuso;CHIUSO;https://www.opencup.gov.it/portale/progetto/-/cup/E26H08000030007
100;I27H03000240003;Lavori di cui al verbale d'urgenza per realizzazione di paratia di pali in c.a. sulla s.p. n. 66 Petritoli nel Comune di Montegiberto.;Infrastrutture / parcheggi;MARCHE;FERMO;MONTE GIBERTO;31212270.0;AMMINISTRAZIONE PROVINCIALE DI ASCOLI PICENO;chiuso;CHIUSO;https://www.opencup.gov.it/portale/progetto/-/cup/I27H03000240003
100;B69B08000170008;MIGLIORAMENTO DELLA STABILITÀ DEI POPOLAMENTI SEMINATURALI DI FAGGIO E ABETE BIANCO IN LOC. VALLE DELLA CORTE;Ambiente / rifiuti / depurazione;MARCHE;ASCOLI PICENO;ACQUASANTA TERME;31175000.0;REGIONE MARCHE;chiuso;CHIUSO;https://www.opencup.gov.it/portale/progetto/-/cup/B69B08000170008
100;C56F09000030003;ACCORDO DI PROGRAMMA OPERE STRUTTURALI DI MESSA IN SICUREZZA IDRAULICA ED APPROVVIGIONAMENTO IDROPOTABILE IN LOC. GELLO E LAGHI PRIMAVERA.;Ambiente / rifiuti / depurazione;TOSCANA;PISTOIA;PISTOIA;31156216.0;COMUNE DI PISTOIA - PT -;programmazione / progetto attivo;ATTIVO;https://www.opencup.gov.it/portale/progetto/-/cup/C56F09000030003
100;I18G12000310005;PALESTRA SCOLASTICA DI VIALE MECENATE IN AREZZO;Sport / impianti sportivi;TOSCANA;AREZZO;AREZZO;31120000.0;AMMINISTRAZIONE PROVINCIALE DI AREZZO;programmazione / progetto attivo;ATTIVO;https://www.opencup.gov.it/portale/progetto/-/cup/I18G12000310005
100;E54E09000070002;STRADA DI GRANDE COMUNICAZIONE FIRENZE-PISA-LIVORNO;Infrastrutture / parcheggi;TOSCANA;PISA;PISA;31095925.0;AMMINISTRAZIONE PROVINCIALE DI PISA;chiuso;CHIUSO;https://www.opencup.gov.it/portale/progetto/-/cup/E54E09000070002
100;J45I00000000003;DEMOLIZIONE VECCHI SPOGLIATOI CAMPO SPORTIVO;Sport / impianti sportivi;LAZIO;ROMA;CASTELNUOVO DI PORTO;30987410.0;COMUNE DI CASTELNUOVO DI PORTO - RM -;chiuso;CHIUSO;https://www.opencup.gov.it/portale/progetto/-/cup/J45I00000000003
100;B71B22001540001;DM_517/2018.DI_04/2022.CICLOVIA TURISTICA NAZIONALE ADRIATICA PERCORSO CHIOGGIA(VENEZIA)-GARGANO.TRATTI NEL TERRITORIO DELLA REGIONE MARCHE.;Infrastrutture / parcheggi;MARCHE;TUTTE;TUTTI;30775601.0;REGIONE MARCHE;programmazione / progetto attivo;ATTIVO;https://www.opencup.gov.it/portale/progetto/-/cup/B71B22001540001
100;F11B10000730004;VARIE STRADE COMUNALI;Sanità / RSA;TOSCANA;PISA;CALCINAIA;30761700.0;COMUNE DI CALCINAIA - PISA -;chiuso;CHIUSO;https://www.opencup.gov.it/portale/progetto/-/cup/F11B10000730004
100;G45F22001170005;COSTRUZIONE NUOVO OSPEDALE DI ACQUAPENDENTE;Sanità / RSA;LAZIO;VITERBO;ACQUAPENDENTE;30406497.0;ASL DI VITERBO;programmazione / progetto attivo;ATTIVO;https://www.opencup.gov.it/portale/progetto/-/cup/G45F22001170005
100;J87H04000840003;OSPEDALE SAN FILIPPO NERI;Sanità / RSA;LAZIO;ROMA;ROMA;30331685.0;ASL DI ROMA 1;programmazione / progetto attivo;ATTIVO;https://www.opencup.gov.it/portale/progetto/-/cup/J87H04000840003
100;D31B19000200003;SR 429;Infrastrutture / parcheggi;TOSCANA;FIRENZE;CASTELFIORENTINO;30100000.0;REGIONE TOSCANA;programmazione / progetto attivo;ATTIVO;https://www.opencup.gov.it/portale/progetto/-/cup/D31B19000200003
100;B18H25000890002;O.C.D.P.C. N. 922/2022 E 1011/2023 E S.M.I._EVENTI METEOROLOGICI VERIFICATISI NELLA REGIONE MARCHE A PARTIRE DAL GIORNO 15 SETTEMBRE 2022. MITIGAZIONE DEL RISCHIO IDRAULICO BACINO IDROGRAFICO MISA/NEVOLA.;Ambiente / rifiuti / depurazione;MARCHE;ANCONA;SENIGALLIA;30000000.0;REGIONE MARCHE;programmazione / progetto attivo;ATTIVO;https://www.opencup.gov.it/portale/progetto/-/cup/B18H25000890002
100;I62F07000010004;PALAZZETTO DELLO SPORT E BOCCIODROMO;Sport / impianti sportivi;MARCHE;ANCONA;BELVEDERE OSTRENSE;30000000.0;COMUNE DI BELVEDERE OSTRENSE - AN -;chiuso;CHIUSO;https://www.opencup.gov.it/portale/progetto/-/cup/I62F07000010004
100;I17I20000000001;NTERVENTI URGENTI DI RISANAMENTO IDROGEOLOGICO E MESSA IN SICUREZZA DEL DISSESTO IDROGEOLOGICO IN ORDINE A VARI FOSSI DEL COMUNE DI MARINO;Ambiente / rifiuti / depurazione;LAZIO;ROMA;MARINO;30000000.0;COMUNE DI MARINO - RM -;programmazione / progetto attivo;ATTIVO;https://www.opencup.gov.it/portale/progetto/-/cup/I17I20000000001
100;F81J22000040005;CORPO ARGINALE E ALVEO DEL FIUME TEVERE NEL TRATTO COMPRESO TRA PONTE MARCONI E LA FOCE;Infrastrutture / parcheggi;LAZIO;ROMA;ROMA;30000000.0;REGIONE LAZIO;programmazione / progetto attivo;ATTIVO;https://www.opencup.gov.it/portale/progetto/-/cup/F81J22000040005
100;I17H03000150003;Lavori di sistemazione del corpo stradale e del piano viabile della strada provinciale n. 65 Palmiano.;Infrastrutture / parcheggi;MARCHE;ASCOLI PICENO;PALMIANO;30000000.0;AMMINISTRAZIONE PROVINCIALE DI ASCOLI PICENO;chiuso;CHIUSO;https://www.opencup.gov.it/portale/progetto/-/cup/I17H03000150003
100;I61B20001330001;AZIENDA OSPEDALIERA UNIVERSITARIA SENESE;Residenziale pubblico / ERS;TOSCANA;SIENA;SIENA;30000000.0;AZIENDA OSPEDALIERA UNIVERSITARIA SENESE;programmazione / progetto attivo;ATTIVO;https://www.opencup.gov.it/portale/progetto/-/cup/I61B20001330001
100;B21B23000660001;COLLEGAMENTO VILLA POTENZA - SAMBUCHETO;Infrastrutture / parcheggi;MARCHE;MACERATA;MONTECASSIANO;30000000.0;REGIONE MARCHE;programmazione / progetto attivo;ATTIVO;https://www.opencup.gov.it/portale/progetto/-/cup/B21B23000660001
100;G83B21000000005;ACCORDO QUADRO PER L'AFFIDAMENTO DEI SERVIZI DI ARCHITETTURA E INGEGNERIA VOLTI ALLA RIQUALIFICAZIONE DEGLI IMMOBILI ATER DEL COMUNE DI ROMA- LOTTI 1,2,3,4,5 E 6. DURATA 4 ANNI;Riqualificazione urbana;LAZIO;ROMA;ROMA;30000000.0;AZIENDA TERRITORIALE PER L'EDILIZIA RESIDENZIALE PUBBLICA DEL COMUNE DI ROMA;programmazione / progetto attivo;ATTIVO;https://www.opencup.gov.it/portale/progetto/-/cup/G83B21000000005
100;F88G08000090002;PRESIDI SANITARI TERRITORIALI;Residenziale pubblico / ERS;LAZIO;TUTTE;TUTTI;30000000.0;REGIONE LAZIO;programmazione / progetto attivo;ATTIVO;https://www.opencup.gov.it/portale/progetto/-/cup/F88G08000090002
100;J63I25000100007;PALASPORT DI VIA DELLE TAGLIATE;Riqualificazione urbana;TOSCANA;LUCCA;LUCCA;30000000.0;COMUNE DI LUCCA - LU -;programmazione / progetto attivo;ATTIVO;https://www.opencup.gov.it/portale/progetto/-/cup/J63I25000100007
100;F91B18000330002;VIA TIBURTINA;Infrastrutture / parcheggi;LAZIO;ROMA;GUIDONIA MONTECELIO;30000000.0;CITTA' METROPOLITANA DI ROMA CAPITALE;programmazione / progetto attivo;ATTIVO;https://www.opencup.gov.it/portale/progetto/-/cup/F91B18000330002
